Papers,Chapter,Notes,Archive
Simultaneous learning and filtering without delusions: a Bayes-optimal combination of Predictive Inference and Adaptive Filtering,"[7,13]","Cite in Chapter 7, good example of learning the forward model. Read. Motor illusions",Paperpile
How higher goals are constructed and collapse under stress: A hierarchical Bayesian control systems perspective,"[7,16]",Good history of cybernetics section including set-points useful for Chapter 7,Paperpile
Perceptions as hypotheses: saccades as experiments,"[7,8,11,15]","Great notation and important perspective on action and Bayesian surprise to add to Chapter 7. Will be useful to refer back to this paper for Chapter 8 because it shows how to construct the block matrices for hierarchical models. For Chapter 15, there is good info here for the equivalence section. Consideration of infomax for example and other equivalences are laid out here. Also, the extension here about salience and hidden state controls needs to be mentioned in Chapter 11.",Paperpile
Computational Models of Interoception and Body Regulation,"[7,8,13]",Nice for Chapter 7 and Chapter 8 alongside very nice visualization that I can use as inspiration in these chapters,Paperpile
Computational Models of Interoception and Body Regulation,"[7,8]",Nice for Chapter 7 and Chapter 8 alongside very nice visualization that I can use as inspiration in these chapters,Paperpile
"Attention, uncertainty, and free-energy",[7],,Paperpile
Autopoiesis and Cognition: The Realization of the Living,[7],Active inference is an example of self-referenced learning in which “the actions of the learner influence its own learning without any valuation process”,Paperpile
Embodied skillful performance: where the action is,[7],"Best diagram of forward model control, very good reference for ch 7",Paperpile
Getting ahead: forward models and their place in cognitive architecture,[7],,Paperpile
Learning a Forward Model of a Reflex,[7],Active inference is an example of self-referenced learning in which “the actions of the learner influence its own learning without any valuation process”,Paperpile
Muscleless motor synergies and actions without movements: From motor neuroscience to cognitive robotics,[7],Good quote in here about action and marinettes. Quote in Chapter 7.,Paperpile
"Prediction, perception and agency",[7],"Good core review of active inference, great for Chapter 7.",Paperpile
Predictions in the eye of the beholder: an active inference account of Watt governors,[7],Cybernetics,ArXiv
Predictions not commands: active inference in the motor system,[7],Read closely for Chapter 7.,Paperpile
Reinforcement learning or active inference?,[7],,Paperpile
The perceptual shaping of anticipatory actions,[7],Also nice for Chapter 7,Paperpile
A computational theory for the production of limb movements,[7],Equilibrium point,ArXiv
Hierarchical disruption in the Bayesian brain: Focal epilepsy and brain networks,"[8,11,13]",Notation - especially for chapter 11. Very important diagram of the error and state unit relationship that should be replicated in Chapter 8!,Paperpile
Active inference and the anatomy of oculomotion,"[8,13]",Notation (continuous). See chapter 8 again. Useful way to consider the derivatives.,Paperpile
Hierarchical predictive coding in distributed pain circuits,"[8,13]","Great figure here on prediction errors, revisit for Chapter 8!",Paperpile
Reclaiming saliency: Rhythmic precision-modulated action and perception,"[8,E,11]",Simulation. DEM notation,Paperpile
A hierarchy of time-scales and the brain,[8],,Paperpile
Active Inference and Learning in the Cerebellum,[8],Notation (continuous),Paperpile
Active inference under visuo-proprioceptive conflict: Simulation and empirical results,[8],Notation (continuous),Paperpile
"Active inference, attention, and motor preparation",[8],Notation (continuous),Paperpile
Canonical neural networks perform active inference,[8],Recognition dynamics,BioArXiv
"Cerebral hierarchies: predictive processing, precision and the pulvinar",[8],Notation (continuous),Paperpile
Computational Neuropsychology and Bayesian Inference,[8],Hierarchical models,Paperpile
Distinguishing theory from implementation in predictive coding accounts of brain function,[8],,Paperpile
Dynamic planning in hierarchical active inference,[8],Good review on hierarchical AIF,ArXiv
"Free energy, precision and learning: the role of cholinergic neuromodulation",[8],Notation (continuous),Paperpile
Modeling motor control in continuous-time Active Inference: a survey,[8],,ArXiv
Reframing the Expected Free Energy: Four Formulations and a Unification,"[9, 11]",Check out,ArXiv
Inferring what to do (and what not to do),"[9,10,11,13]",Good notation for discrete time,Paperpile
A step-by-step tutorial on active inference and its application to empirical data,"[9,10]",,Paperpile
Active inference and agency: optimal control without cost functions,"[9,10]",,Paperpile
Active inference and epistemic value,"[9,10]",,Paperpile
Active inference and learning,"[9,10]",,Paperpile
Active inference on discrete state-spaces: A synthesis,"[9,10]",,Paperpile
"Active Inference, Curiosity and Insight","[9,10]",,Paperpile
Active Inference: A Process Theory,"[9,10]",,Paperpile
Cognitive effort and active inference,"[9,10]",Great discrete time notation and explanation,Paperpile
Computational mechanisms of curiosity and goal-directed exploration,"[9,10]",Notation (discrete),Paperpile
Computational Phenotyping in Psychiatry: A Worked Example,"[9,10]",Code and notation,Paperpile
Contextual perception under active inference,"[9,10]",Important and notation,Paperpile
Deep Active Inference and Scene Construction,"[9,10]",EFE derivation,Paperpile
Deep temporal models and active inference,"[9,10]",Hierarchical discrete example. Discussion of information gain and infomax among other things.,Paperpile
"Dopamine, reward learning, and active inference","[9,10]",,Paperpile
Everything is connected: Inference and attractors in delusions,"[9,10]",Notation (discrete),Paperpile
"Exploration, novelty, surprise, and free energy minimization","[9,10]",,Paperpile
Impulsivity and Active Inference,"[9,10]",Discrete time notation including action selection types. Check out VFE and EFE equations in matrix form here.,Paperpile
Introducing a Bayesian model of selective attention based on active inference,"[9,10]",Notation (discrete),Paperpile
Prefrontal Computation as Active Inference,"[9,10]",Good discrete notation and simulation,Paperpile
pymdp: A Python library for active inference in discrete state spaces,"[9,10]",Make sure cited.,ArXiv
"Scene Construction, Visual Foraging, and Active Inference","[9,10]",Notation for factorial depth in discrete time models?,Paperpile
Simulating lesion-dependent functional recovery mechanisms,"[9,10]",Full notation for the learning update rules in discerete time active inference,Paperpile
Synthetic Spatial Foraging With Active Inference in a Geocaching Task,"[9,10]",Notation (discrete),Paperpile
The anatomy of choice: active inference and agency,"[9,10]",,Paperpile
The anatomy of choice: dopamine and decision-making,"[9,10]",Mostly irrelevant but good to read to extract some useful information,Paperpile
"Working memory, attention, and salience in active inference","[9,10]","Notation for discrete time active inference, see Chapter 9. See also notation for action selection.",Paperpile
Active sensing with predictive coding and uncertainty minimization,[9],Discrete AIF examples,Pubmed (after Sept 2023)
Adaptive planning depth in human problem solving,[9],Planning depth,BioArXiv
An Active Inference Model of the Optimism Bias,[9],Optimistic agents via precision over positive outcomes,PsyArXiv
"Generative models, linguistic communication and active inference",[9],Look closely at the notation here for outcomes and states!,Paperpile
Integrating cognitive map learning and active inference for planning in ambiguous environments,[9],Planning under uncertainty,ArXiv
Planning and navigation as active inference,[9],"Great discrete time notation, look at table here for Chapter 9; also Bayesian model averaging equation",Paperpile
Slow but flexible or fast but rigid? Discrete and continuous processes compared,[9],Part II intro?,BioArXiv
What is value-accumulated reward or evidence?,"[A,7,9]",Precursor to discrete time active inference. Worth taking a closer look to see if I put this in Appendix A yet and how they try to extend continuous time action into planning.,Paperpile
Granger causality revisited,[B],Return to this paper for some ideas on causality,Paperpile