Papers,Chapter,Notes,Archive
Active inference as a theory of sentient behavior,"[1, 15]",History of predictive coding; unification,Pubmed (after Sept 2023)
Active Inference for Autonomous Decision-Making with Contextual Multi-Armed Bandits,[10],MABs,ArXiv
An empirical evaluation of active inference in multi-armed bandits,[10],MABs,ArXiv
Inferring Hierarchical Structure in Multi-Room Maze Environments,[10],Hierarchical models,ArXiv
Learning Spatial and Temporal Hierarchies: Hierarchical Active Inference for navigation in Multi-Room Maze Environments,[10],Hierarchical active inference,ArXiv
Learning generative state space models for active inference,"[11,13]",They start paper describing some of the current limitations with RL approaches in the real-world. Nice references here. Simulation.,Paperpile
Turn-Taking Mechanisms in Imitative Interaction: Robotic Social Interaction Based on the Free Energy Principle,"[11,14]",Simulation,Paperpile
A Bayesian account of generalist and specialist formation under the Active Inference framework,[11],Habit learning,BioArXiv
A Methods paper for object representation,[11],Reactive control,Paperpile
A mixed generative model of auditory word repetition,[11],Hybrid models,BioArXiv
Active Inference and Behavior Trees for Reactive Action Planning and Execution in Robotics,[11],,Paperpile
Active Inference for Autonomous Decision-Making with Contextual Multi-Armed Bandits,[11],,Paperpile
"Active inference for integrated state-estimation, control, and learning",[11],Cool paper because they add some tunability into AIF controllers with the tau parameter. Would make a good figure. See also the details in Chapter 15.,Paperpile
Active Inference for Robotic Manipulation,[11],Simulation,Paperpile
An active inference implementation of phototaxis,[11],Simulation,Paperpile
Balancing control: a Bayesian interpretation of habitual and goal-directed behavior,[11],Habit formation,BioArXiv
Branching Time Active Inference with Bayesian Filtering,[11],Check that it is cited,ArXiv
Branching Time Active Inference: empirical study and complexity class analysis,[11],Check that it is cited,ArXiv
Branching Time Active Inference: the theory and its generality,[11],Check that it is cited,ArXiv
Chance-constrained active inference,[11],Self-supervised objective - do not need to reconstruct outputs of actions.,Paperpile
Combining active inference and hierarchical predictive coding: a tutorial introduction and case study,[11],Simulation,Paperpile
Contrastive active inference,[11],"One particular challenge with such discrete state-space active inference models is the fact that it is difficult to scale the model to a large number of states and quickly becomes computationally expensive. In Chapter 13 we described \textit{contrastive active inference} \citep{Mazzaglia2021-oj} a possible approach to more effecient discrete-state space active inference-based control using contrastive learning. The authors in this paper argue that since complete pixel-level visual reconstruction is expensive and may be unnecessary for many tasks, the model's complexity can be reduced if it selectively choose which observations are relevant for the decision-making task at hand. After augmenting VFE and EFE with a contrastive loss term, the model better identifies similar observations that were likely generate by the hidden state to be inferred. ",Paperpile
Embodied object representation learning and recognition,[11],Reactive control,Paperpile
Generalized Simultaneous Localization and Mapping (G-SLAM) as unification framework for natural and artificial intelligences: towards reverse engineering the hippocampal/entorhinal system and principles of high-level cognition,[11],,Paperpile
Goal-directed Planning and Goal Understanding by Active Inference: Evaluation Through Simulated and Physical Robot Experiments,[11],Simulation. Alternative computation of EFE,Paperpile
"Investigation of the Sense of Agency in Social Cognition, Based on Frameworks of Predictive Coding and Active Inference: A Simulation Study on Multimodal Imitative Interaction",[11],Simulation,Paperpile
Meta-control of the exploration-exploitation dilemma emerges from probabilistic inference over a hierarchy of time scales,[11],Chapter 11? The authors introduce meta-control states into the model.,Paperpile
Modeling the subjective perspective of consciousness and its role in the control of behaviours,[11],Simulation,Paperpile
Multi-Modal and Multi-Factor Branching Time Active Inference,[11],Branching time AIF,ArXiv
Multimodal VAE active inference controller,[11],Simulation,Paperpile
Online reinforcement learning with sparse rewards through an active inference capsule,[11],FEEF,ArXiv
Predictive coding-based deep dynamic neural network for visuomotor learning,[11],Simulation,Paperpile
Prior Preference Learning from Experts: Designing a Reward with Active Inference,[11],C vector learning,ArXiv
The computational neurology of movement under active inference,[11],Simulation of tendon reflex with a mixed generative model. Great example. Cite this simulation. Also check out the table here which lists some parameters and the resulting pathologies.,Paperpile
The Discrete and Continuous Brain: From Decisions to Movement-And Back Again,[11],Hybrid models,Paperpile
Unbiased Active Inference for Classical Control,[11],Drawback: AIC biased toward current goal prior (poor state estimation). Influences precision learning by biasing parameter convergence. False-positive fault detection. Control action not an random variable. Thus cannot minimize directly and must use the chain rule (assumes system is linear).,Paperpile
"Uncertainty, epistemics and active inference",[11],Excellent discrete time notation. Add to Chapter 11 - precision updating for discrete time active inference.,Paperpile
Variational Inference for Predictive and Reactive Controllers,[11],"The authors interpret the work in \citep{Oliver2019-uo, Pezzato2019-mx} in terms of \textit{reactive control}. They point out the fact that because continuous state-space active inference can only adaptively react to prediction errors it will have a much slower response. By separating the state-estimation and action steps the model can run them in parallel and adapt faster to environmental changes. Reactive control. Re-read this paper in more detail. It's kind of a robotics paper but really they introduce a few modifications to generalized filtering.",Paperpile
MULAN: Evaluation and ensemble statistical inference for functional connectivity,"[12,15]",Maybe chapter 16?,Paperpile
A Factor Graph Description of Deep Temporal Active Inference,[12],,Paperpile
A Unified View of Algorithms for Path Planning Using Probabilistic Inference on Factor Graphs,[12],,ArXiv
Active Inference and Epistemic Value in Graphical Models,[12],Look very important,Paperpile
Active inference for robot control: a factor graph approach,[12],,Paperpile
"Active Inference, Belief Propagation, and the Bethe Approximation",[12],,Paperpile
"Neuronal message passing using Mean-field, Bethe, and Marginal approximations",[12],,Paperpile
Realising Active Inference in Variational Message Passing: the Outcome-blind Certainty Seeker,[12],Make sure cited.,ArXiv
Simulating Active Inference Processes by Message Passing,[12],,Paperpile
The Anatomy of Inference: Generative Models and Brain Structure,[12],,Paperpile
The graphical brain: Belief propagation and active inference,[12],,Paperpile
Toward Design of Synthetic Active Inference Agents by Mere Mortals,[12],Factor graph approaches to AIF,ArXiv
A Bayesian Account of the Sensory-Motor Interactions Underlying Symptoms of Tourette Syndrome,[13],Read. Motor illusions,Paperpile
A novel model of divergent predictive perception,[13],Dysfunction,Pubmed (after Sept 2023)
A predictive processing theory of sensorimotor contingencies: Explaining the puzzle of perceptual presence and its absence in synesthesia,[13],Read. Motor illusions,Paperpile
Active inference and the two-step task,[13],Cite. Decision-making and impulsivity,Paperpile
Active inference on OpenAI gym: a paradigm for computational investigations into psychiatric illness,[13],Cite. Decision-making and impulsivity,Paperpile
"Active inference, morphogenesis, and computational psychiatry",[13],Psychopathology,PsyArXiv
An Active Inference Approach to Dissecting Reasons for Nonadherence to Antidepressants,[13],Habit formation,Paperpile
Being curious about the answers to questions: novelty search with learned attention,[13],Curiosity,ArXiv
Caching mechanisms for habit formation in active inference,[13],Habit formation,Paperpile
Can the Predictive Processing Framework Explain the Persistence of Delusional Beliefs?,[13],Neuropathology,Pubmed (after Sept 2023)
Can You Tickle Yourself If You Swap Bodies with Someone Else?,[13],Read. Motor illusions,Paperpile
Dopamine Role in Learning and Action Inference,[13],Cite. Decision-making and impulsivity,Paperpile
Embodied decisions as active inference,[13],Decision-making,BioArXiv
Enacting proprioceptive predictions in the rubber hand illusion,[13],Read. Auditory hallucinations,Paperpile
Flexible intentions: an active inference theory,[13],Read. Decision-making and impulsivity. Notation (discrete),Paperpile
How preferences enslave attention: calling into question the endogenous/exogenous distinction from an active inference perspective,[13],Attention,PsyArXiv
Imprecise action selection in substance use disorder: evidence for active learning impairments when solving the explore-exploit dilemma,[13],Habit formation,Paperpile
Inference of affordances and active motor control in simulated agents,[13],Read,Paperpile
Insight and the selection of ideas,[13],Insight,PsyArXiv
"Is interesting knowledge a reward? An integrative model of emotion, reward and appraisal frameworks of epistemic curiosity.",[13],Curiosity,PsyArXiv
Learning action-oriented models through active inference,[13],Goal-directed behavior,BioArXiv
"Model averaging, optimal inference, and habit formation",[13],Habit formation,Paperpile
On Predictive Planning and Counterfactual Learning in Active Inference,[13],Decision-making,Pubmed (after Sept 2023)
Predictive coding explains binocular rivalry: an epistemological review ,[13],Cite. Visual illusions,Paperpile
"Preferences need inferences: Learning, valuation, and curiosity in aesthetic experience",[13],Curiosity,PsyArXiv
Spatial and Temporal Hierarchy for Autonomous Navigation Using Active Inference in Minigrid Environment,[13],Goal-directed behavior,Pubmed (after Sept 2023)
Symmetry and complexity in object-centric deep active inference models,[13],,Paperpile
The control of epistemic curiosity in the human brain,[13],Curiosity,BioArXiv
With an eye on uncertainty: Modeling pupillary responses to environmental volatility,[13],Cite. Decision-making and impulsivity,Paperpile
A Novel Adaptive Controller for Robot Manipulators based on Active Inference,[14],Robotics,ArXiv
Active inference and robot control: a case study,[14],,Paperpile
Active Inference Through Energy Minimization in Multimodal Affective Human-Robot Interaction,[14],,Paperpile
Active Vision for Robot Manipulators Using the Free Energy Principle,[14],,Paperpile
Adaptation through prediction: multisensory active inference torque control,[14],"Robotics, torque controller",ArXiv
An active inference model of car following: Advantages and applications,[14],Robotics,ArXiv
Dynamic Expectation Maximization Algorithm for Estimation of Linear Systems with Colored Noise,[14],,Paperpile
Learning Policies for Continuous Control via Transition Models,[14],Learning generative models,ArXiv
Navigating Autonomous Vehicle on Unmarked Roads with Diffusion-Based Motion Prediction and Active Inference,[14],Self-driving,ArXiv
"Neuroscience-inspired perception-action in robotics: applying active inference for state estimation, control and self-perception",[14],Make sure this is in the reviews,ArXiv
Object-Centric Scene Representations Using Active Inference,[14],Make sure cited,Pubmed (after Sept 2023)
Predictive Processing in Cognitive Robotics: a Review,[14],Make sure cited,ArXiv
Resolving uncertainty on the fly: modeling adaptive driving behavior as active inference,[14],Autonomous driving,Pubmed (after Sept 2023)
Tactile Active Inference Reinforcement Learning for Efficient Robotic Manipulation Skill Acquisition,[14],Make sure cited,ArXiv
Trust as Extended Control: Human-Machine Interactions as Active Inference,[14],,Paperpile
World Models and Predictive Coding for Cognitive and Developmental Robotics: Frontiers and Challenges,[14],Make sure cited,ArXiv
Retrospective surprise: A computational component for active inference,"[15,16]",Not sure where to put it,PsyArXiv
‘Through others we become ourselves’: The dialectics of predictive coding and active inference,[15],Social interaction,PsyArXiv
A Bayesian perspective on classical control,[15],Equivalence,ArXiv
Active Inference and Reinforcement Learning: A unified inference on continuous state and action spaces under partial observability,[15],Reinforcement learning,ArXiv
Active Inference as a Framework for Brain-Computer Interfaces,[15],Cybernetics - brain computer interfaces,BioArXiv
Active Inference as a Model of Agency,[15],Agency and RL,ArXiv
Active Inference Demonstrated with Artificial Spin Ice,[15],,ArXiv
Active Inference for Adaptive BCI: application to the P300 Speller,[15],Cybernetics - brain computer interfaces,ArXiv
Active Inference for Stochastic Control,[15],Compare to RL,ArXiv
Active Inference in Hebbian Learning Networks,[15],Deep AIF,ArXiv
Active Inference in String Diagrams: A Categorical Account of Predictive Processing and Free Energy,[15],Category theory,ArXiv
Active inference models do not contradict folk psychology,[15],Emotion,PsyArXiv
Active Inference on the Edge: A Design Study,[15],Federated AIF? Belief sharing?,ArXiv
Active Inference or Control as Inference? A Unifying View,[15],Equivalence,ArXiv
Active Inference-Based Optimization of Discriminative Neural Network Classifiers,[15],Deep AIF,ArXiv
"Active inference, Bayesian optimal design, and expected utility",[15],Bayesian optimal design,ArXiv
"Active inference, stressors, and psychological trauma: A neuroethological model of (mal)adaptive explore-exploit dynamics in ecological context",[15],Allostasis (maybe?),BioArXiv
Adaptive oscillators support Bayesian prediction in temporal processing,[15],Coordinated behavior,Pubmed (after Sept 2023)
AFA-PredNet: The action modulation within predictive coding,[15],Deep AIF,ArXiv
"All thinking is ""wishful"" thinking",[15],"This one is important for answering some of the higher order questions about belief updating and motivation. The related papers are ""Hierarchical active inference: a theory of motivated control"" and ""Active Inference, homeostatic regulation and adaptive behavioral control"". In Chapter 16 it may be important to build up some of the grander theories.",Paperpile
Allostasis as a core feature of hierarchical gradients in the human brain,[15],Interoceptive inference,Pubmed (after Sept 2023)
Allostatic interoceptive overload across psychiatric and neurological conditions,[15],Allostasis,Pubmed (after Sept 2023)
An Overview of the Free Energy Principle and Related Research,[15],RL,Pubmed (after Sept 2023)
Anomaly Detection via Controlled Sensing and Deep Active Inference,[15],Deep AIF,ArXiv
Bayesian policy selection using active inference,[15],RL v. AIF,ArXiv
Being a beast machine: The origins of selfhood in control-oriented interoceptive inference,[15],Already cited?,PsyArXiv
Bidirectional Interaction between Visual and Motor Generative Models using Predictive Coding and Active Inference,[15],"Robotics, motor control",ArXiv
Blockchain-Based Decentralized Knowledge Marketplace Using Active Inference,[15],,ArXiv
Capsule Networks as Generative Models,[15],Deep AIF,ArXiv
Collective behavior from surprise minimization,[15],Collective behavior,Pubmed (after Sept 2023)
Compositional Active Inference I: Bayesian Lenses. Statistical Games,[15],Category theory,ArXiv
Compositional Active Inference II: Polynomial Dynamics. Approximate Inference Doctrines,[15],Category theory,ArXiv
"Correction: Hybrid predictive coding: Inferring, fast and slow",[15],Deep AIF and Deep PC,Pubmed (after Sept 2023)
Deep active inference agents using Monte-Carlo methods,[15],Deep AIF,ArXiv
Deep Active Inference for Partially Observable MDPs,[15],Vs RL,ArXiv
Deep Active Inference for Pixel-Based Discrete Control: Evaluation on the Car Racing Problem,[15],Vs RL,ArXiv
Deriving time-averaged active inference from control principles,[15],Optimal control theory,ArXiv
Designing explainable artificial intelligence with active inference: A framework for transparent introspection and decision-making,[15],Introspection and selfhood,ArXiv
Disentangling Shape and Pose for Object-Centric Deep Active Inference Models,[15],Deep AIF,ArXiv
Forgetting ourselves in flow: an active inference account of flow states and how we experience ourselves within them,[15],Selfhood,Pubmed (after Sept 2023)
Hybrid Active Inference,[15],Cybernetics,ArXiv
"I like therefore I can, and I can therefore I like: the role of self-efficacy and affect in active inference of allostasis",[15],Homeostasis,Pubmed (after Sept 2023)
Kalman filters as the steady-state solution of gradient descent on variational free energy,[15],Equivalence,ArXiv
Learning Generative Models for Active Inference using Tensor Networks,[15],Deep AIF,ArXiv
Mathematical Foundations for a Compositional Account of the Bayesian Brain,[15],Category theory,ArXiv
Neural dynamics under active inference: plausibility and efficiency of information processing,[15],Effeciency. May already be cited.,ArXiv
Object-based active inference,[15],Deep AIF,ArXiv
"On Kalman-Bucy filters, linear quadratic control and active inference",[15],Equivalence,ArXiv
On Solving a Stochastic Shortest-Path Markov Decision Process as Probabilistic Inference,[15],RL?,ArXiv
On the Relationship Between Active Inference and Control as Inference,[15],Equivalence,ArXiv
Planning to Learn: A Novel Algorithm for Active Learning during Model-Based Planning,[15],Equivalency. Comparison to Bayes-adaptive RL,Paperpile
Predictive Coding as a Neuromorphic Alternative to Backpropagation: A Critical Evaluation,[15],PC and backprop,Pubmed (after Sept 2023)
Predictive Minds: LLMs As Atypical Active Inference Agents,[15],LLMs,ArXiv
Predictive Motor Control Based on a Generative Adversarial Network,[15],Deep AIF,BioArXiv
Reinforcement Learning through Active Inference,[15],Equivalence,ArXiv
Resonating Minds -- Emergent Collaboration Through Hierarchical Active Inference,[15],Collective behavior,ArXiv
Shared Protentions in Multi-Agent Active Inference,[15],Multi agent,Pubmed (after Sept 2023)
"Simulating homeostatic, allostatic and goal-directed forms of interoceptive control using Active Inference",[15],Interoception,BioArXiv
Social intelligence model with multiple internal models,[15],Collective behavior,BioArXiv
Spin glass systems as collective active inference,[15],Collective behavior,ArXiv
Successor Representation Active Inference,[15],RL: Successor representation,ArXiv
"The cognitive neuroscience of self-awareness: Current framework, clinical implications, and future research directions",[15],Selfhood,Pubmed (after Sept 2023)
The Free Energy Principle for Perception and Action: A Deep Learning Perspective,[15],Deep AIF,ArXiv
The Homeostatic Logic of Reward,[15],Homeostasis,BioArXiv
The modularity of action and perception revisited using control theory and active inference,[15],Equivalence,ArXiv
The Role of Valence and Meta-awareness in Mirror Self-recognition Using Hierarchical Active Inference,[15],Book 2,ArXiv
Towards Understanding Persons and their Personalities with Cybernetic Big 5 Theory and the Free Energy Principle and Active Inference (FEP-AI) Framework,[15],"Review, check out, emotions",PsyArXiv
An information-theoretic perspective on the costs of cognition,[15],Information theory,BioArXiv
Interactive inference: a multi-agent model of cooperative joint actions,[15],Multi-agent,ArXiv
On efficient computation in active inference,[15],Deep AIF,ArXiv
A Free Energy Principle for Biological Systems,[16],,Paperpile
A probabilistic interpretation of PID controllers using active inference,[16],Equivalency,Paperpile
Active inference or control as inference? A unifying view,[16],Equivalency,Paperpile
Application of the free energy principle to estimation and control,[16],Equivalency,Paperpile
Deep active inference as variational policy gradients,[16],Equivalency. Policy gradients,Paperpile
"Free energy, value, and attractors",[16],,Paperpile
"On Kalman bucy filters, linear quadratic control, and active inference",[16],Equivalency,Paperpile
On the relationship between active inference and control as inference,[16],Equivalency,Paperpile
PID control as a process of active inference with linear generative models,[16],Equivalency,Paperpile
The free-energy principle: a unified brain theory?,[16],,Paperpile
"The relationship between dynamic programming and active inference: The discrete, finite-horizon case",[16],Equivalency. Bellman optimality and dynamic programming,Paperpile
A Neural Network Implementation for Free Energy Principle,[4],Comparing AIF and Helmholtz machine,ArXiv
Reverse engineering neural networks to characterise their cost functions,[4],VFE minimization and cost functions.,BioArXiv
Surprise: a unified theory and experimental predictions,[4],Many ways to interpret surprisal,BioArXiv
Variational approximations,[4],MacKay 1992,Paperpile
Canonical neural networks perform active inference,[4],Neural substrate,Paperpile
Cultured Cortical Neurons Can Perform Blind Source Separation According to the Free-Energy Principle,[4],Neural substrate,Paperpile
Emergence of associative learning in a neuromorphic inference network,[4],Neural substrate,Paperpile
Experimental validation of the free-energy principle with in vitro neural networks,[4],Neural substrate,Paperpile
In vitro neural networks minimise variational free energy,[4],Neural substrate,Paperpile
In vitro neurons learn and exhibit sentience when embodied in a simulated game-world,[4],Neural substrate,Paperpile
Linking Neuromodulated Spike-Timing Dependent Plasticity with the Free-Energy Principle,[4],Neural substrate,Paperpile
Noise Helps Optimization Escape From Saddle Points in the Synaptic Plasticity,[4],Neural substrate,Paperpile
The emergence of synchrony in networks of mutually inferring neurons,[4],Neural substrate,Paperpile
Active inference leads to Bayesian neurophysiology,[4],Neural substrate,Paperpile
A theory of cortical responses,[5],,Paperpile
"Active Predictive Coding: A Unifying Neural Model for Active Perception, Compositional Learning, and Hierarchical Planning",[5],Active predictive coding,Pubmed (after Sept 2023)
Applications of the Free Energy Principle to Machine Learning and Neuroscience,[5],Predictive coding,ArXiv
Combining Active Inference and Hierarchical Predictive Coding: A Tutorial Introduction and Case Study,[5],AIF and predictive coding,PsyArXiv
Functional integration and inference in the brain,[5],,Paperpile
Implementing Predictive Processing and Active Inference: Preliminary Steps and Results,[5],Active predictive coding?,PsyArXiv
Learning and inference in the brain,[5],,Paperpile
Predictive coding networks for temporal prediction,[5],Temporal PC,Pubmed (after Sept 2023)
Active inference and oculomotor pursuit: the dynamic causal modelling of eye movements,"[6,7,8,13]",Notation (continuous),Paperpile
"Active inference, sensory attenuation and illusions","[6,7,8,13]",Excellent notation examples.Motor illusions,Paperpile
A free energy principle for the brain,"[6,7,8]",,Paperpile
Active inference unifies intentional and conflict-resolution imperatives of motor control,"[6,7,8]",Notation (continuous),Paperpile
"Active inference, eye movements and oculomotor delays","[6,7,8]","Notation (continuous), great appendix!",Paperpile
Active strategies for multisensory conflict suppression in the virtual hand illusion,"[6,7,8]",Notation (Laplace),Paperpile
"Dopamine, affordance and active inference","[6,7,8]",Great notation esp. for hiearchical models,Paperpile
Hallucinations both in and out of context: An active inference account,"[6,7,8]",Notation (continuous),Paperpile
Precision and False Perceptual Inference,"[6,7,8]",Mostly seems to be a review of older simulations,Paperpile
The computational anatomy of psychosis,"[6,7,8]","Notation, see also figure of the effect of the posterior shift",Paperpile
Cortical circuits for perceptual inference,"[6,8]",Best continuous time notation explanation and Laplace assumption,Paperpile
DEM: a variational treatment of dynamic systems,"[6,8]",,Paperpile
Hierarchical models in the brain,"[6,8]",,Paperpile
Perception and hierarchical dynamics,"[6,8]","Chapter 8, important core paper to read, good simulation setup here, maybe useful. Good continuous state space notation",Paperpile
"Predictive coding, precision and synchrony","[6,8]",,Paperpile
Recognition Dynamics in the Brain under the Free Energy Principle,"[6,8]",Good continuous state space notation,Paperpile
Variational Bayesian identification and prediction of stochastic nonlinear dynamic causal models,"[6,8]",Never seen this paper but it seems very important. Revisit. Also has some nice descriptions of stochastic processes.,Paperpile
Variational filtering,"[6,8]",,Paperpile
Variational free energy and the Laplace approximation,"[6,8]",,Paperpile
Waves of prediction,"[6,8]",,Paperpile
A Minimal Active Inference Agent,[6],Simulation,ArXiv
