PMID,Title,Authors,Citation,First Author,Journal/Book,Publication Year,Create Date,PMCID,NIHMS ID,DOI
"18547818","Population dynamics: variance and the sigmoid activation function","Marreiros AC, Daunizeau J, Kiebel SJ, Friston KJ.","Neuroimage. 2008 Aug 1;42(1):147-57. doi: 10.1016/j.neuroimage.2008.04.239. Epub 2008 Apr 29.","Marreiros AC","Neuroimage","2008","2008/06/13","","","10.1016/j.neuroimage.2008.04.239"
"31824382","The Gravity of Objects: How Affectively Organized Generative Models Influence Perception and Social Behavior","Connolly P.","Front Psychol. 2019 Nov 21;10:2599. doi: 10.3389/fpsyg.2019.02599. eCollection 2019.","Connolly P","Front Psychol","2019","2019/12/12","PMC6881275","","10.3389/fpsyg.2019.02599"
"1915028","Cerebral function in aging and Alzheimer's disease: the role of PET","Friston KJ, Frackowiak RS.","Electroencephalogr Clin Neurophysiol Suppl. 1991;42:355-65.","Friston KJ","Electroencephalogr Clin Neurophysiol Suppl","1991","1991/01/01","","",""
"31540852","Dynamics versus dualism: Comment on ""Is temporo-spatial dynamics the 'common currency' of brain and mind?"" by Georg Northoff et al","Friston K.","Phys Life Rev. 2020 Jul;33:70-72. doi: 10.1016/j.plrev.2019.09.002. Epub 2019 Sep 12.","Friston K","Phys Life Rev","2020","2019/09/22","","","10.1016/j.plrev.2019.09.002"
"24137116","The embodied transcendental: a Kantian perspective on neurophenomenology","Khachouf OT, Poletti S, Pagnoni G.","Front Hum Neurosci. 2013 Sep 30;7:611. doi: 10.3389/fnhum.2013.00611. eCollection 2013.","Khachouf OT","Front Hum Neurosci","2013","2013/10/19","PMC3786226","","10.3389/fnhum.2013.00611"
"19003479","Dynamic causal modelling for EEG and MEG","Kiebel SJ, Garrido MI, Moran RJ, Friston KJ.","Cogn Neurodyn. 2008 Jun;2(2):121-36. doi: 10.1007/s11571-008-9038-0. Epub 2008 Apr 23.","Kiebel SJ","Cogn Neurodyn","2008","2008/11/13","PMC2427062","","10.1007/s11571-008-9038-0"
"15808966","Valid conjunction inference with the minimum statistic","Nichols T, Brett M, Andersson J, Wager T, Poline JB.","Neuroimage. 2005 Apr 15;25(3):653-60. doi: 10.1016/j.neuroimage.2004.12.005.","Nichols T","Neuroimage","2005","2005/04/06","","","10.1016/j.neuroimage.2004.12.005"
"17884582","A Metropolis-Hastings algorithm for dynamic causal models","Chumbley JR, Friston KJ, Fearn T, Kiebel SJ.","Neuroimage. 2007 Nov 15;38(3):478-87. doi: 10.1016/j.neuroimage.2007.07.028. Epub 2007 Aug 7.","Chumbley JR","Neuroimage","2007","2007/09/22","","","10.1016/j.neuroimage.2007.07.028"
"19226186","Causal modelling and brain connectivity in functional magnetic resonance imaging","Friston K.","PLoS Biol. 2009 Feb 17;7(2):e33. doi: 10.1371/journal.pbio.1000033.","Friston K","PLoS Biol","2009","2009/02/20","PMC2642881","","10.1371/journal.pbio.1000033"
"24998031","The functional anatomy of schizophrenia: A dynamic causal modeling study of predictive coding","Fogelson N, Litvak V, Peled A, Fernandez-del-Olmo M, Friston K.","Schizophr Res. 2014 Sep;158(1-3):204-12. doi: 10.1016/j.schres.2014.06.011. Epub 2014 Jul 3.","Fogelson N","Schizophr Res","2014","2014/07/07","PMC4166404","","10.1016/j.schres.2014.06.011"
"32883601","Cognition coming about: Self-organisation and free-energy: Commentary on Wright, J.J. and Bourke, P.D. (2020) ""The growth of cognition: Free energy minimization and the embryogenesis of cortical computation""","Hipólito I, Ramstead M, Constant A, Friston KJ.","Phys Life Rev. 2021 Mar;36:44-46. doi: 10.1016/j.plrev.2020.08.001. Epub 2020 Aug 14.","Hipólito I","Phys Life Rev","2021","2020/09/05","","","10.1016/j.plrev.2020.08.001"
"20408209","Transient phase-locking and dynamic correlations: Are they the same thing?","Friston KJ, Stephan KM, Frackowiak RS.","Hum Brain Mapp. 1997;5(1):48-57. doi: 10.1002/(SICI)1097-0193(1997)5:1<48::AID-HBM5>3.0.CO;2-N.","Friston KJ","Hum Brain Mapp","1997","2010/04/22","","","10.1002/(SICI)1097-0193(1997)5:1<48::AID-HBM5>3.0.CO;2-N"
"28082860","Evaluating the Influence of Spatial Resampling for Motion Correction in Resting-State Functional MRI","Yuan L, He H, Zhang H, Zhong J.","Front Neurosci. 2016 Dec 27;10:591. doi: 10.3389/fnins.2016.00591. eCollection 2016.","Yuan L","Front Neurosci","2016","2017/01/14","PMC5186805","","10.3389/fnins.2016.00591"
"33500908","The Active Inference Approach to Ecological Perception: General Information Dynamics for Natural and Artificial Embodied Cognition","Linson A, Clark A, Ramamoorthy S, Friston K.","Front Robot AI. 2018 Mar 8;5:21. doi: 10.3389/frobt.2018.00021. eCollection 2018.","Linson A","Front Robot AI","2018","2021/01/27","PMC7805975","","10.3389/frobt.2018.00021"
"29038652","Hierarchical Recursive Organization and the Free Energy Principle: From Biological Self-Organization to the Psychoanalytic Mind","Connolly P, van Deventer V.","Front Psychol. 2017 Sep 26;8:1695. doi: 10.3389/fpsyg.2017.01695. eCollection 2017.","Connolly P","Front Psychol","2017","2017/10/18","PMC5623195","","10.3389/fpsyg.2017.01695"
"16387513","Large-scale neural models and dynamic causal modelling","Lee L, Friston K, Horwitz B.","Neuroimage. 2006 May 1;30(4):1243-54. doi: 10.1016/j.neuroimage.2005.11.007. Epub 2006 Jan 4.","Lee L","Neuroimage","2006","2006/01/03","","","10.1016/j.neuroimage.2005.11.007"
"26921713","Dynamic causal modelling of eye movements during pursuit: Confirming precision-encoding in V1 using MEG","Adams RA, Bauer M, Pinotsis D, Friston KJ.","Neuroimage. 2016 May 15;132:175-189. doi: 10.1016/j.neuroimage.2016.02.055. Epub 2016 Feb 24.","Adams RA","Neuroimage","2016","2016/02/28","PMC4862965","","10.1016/j.neuroimage.2016.02.055"
"22197528","Competitive dynamics in the brain: Comment on ""Information flow dynamics in the brain"" by M.I. Rabinovich et al","Friston K.","Phys Life Rev. 2012 Mar;9(1):76-7; discussion 80-3. doi: 10.1016/j.plrev.2011.12.006. Epub 2011 Dec 21.","Friston K","Phys Life Rev","2012","2011/12/27","","","10.1016/j.plrev.2011.12.006"
"11304086","Modeling geometric deformations in EPI time series","Andersson JL, Hutton C, Ashburner J, Turner R, Friston K.","Neuroimage. 2001 May;13(5):903-19. doi: 10.1006/nimg.2001.0746.","Andersson JL","Neuroimage","2001","2001/04/17","","","10.1006/nimg.2001.0746"
"31339798","Quantitative relations between transient BOLD responses, cortical energetics, and impulse firing in different cortical regions","Bennett MR, Farnell L, Gibson WG.","J Neurophysiol. 2019 Sep 1;122(3):1226-1237. doi: 10.1152/jn.00171.2019. Epub 2019 Jul 24.","Bennett MR","J Neurophysiol","2019","2019/07/25","","","10.1152/jn.00171.2019"
"15627578","Bayesian fMRI time series analysis with spatial priors","Penny WD, Trujillo-Barreto NJ, Friston KJ.","Neuroimage. 2005 Jan 15;24(2):350-62. doi: 10.1016/j.neuroimage.2004.08.034.","Penny WD","Neuroimage","2005","2005/01/04","","","10.1016/j.neuroimage.2004.08.034"
"10770230","Image registration using a symmetric prior--in three dimensions","Ashburner J, Andersson JL, Friston KJ.","Hum Brain Mapp. 2000 Apr;9(4):212-25. doi: 10.1002/(sici)1097-0193(200004)9:4<212::aid-hbm3>3.0.co;2-#.","Ashburner J","Hum Brain Mapp","2000","2000/04/19","PMC6871943","","10.1002/(sici)1097-0193(200004)9:4<212::aid-hbm3>3.0.co;2-#"
"18603449","False discovery rate revisited: FDR and topological inference using Gaussian random fields","Chumbley JR, Friston KJ.","Neuroimage. 2009 Jan 1;44(1):62-70. doi: 10.1016/j.neuroimage.2008.05.021. Epub 2008 May 23.","Chumbley JR","Neuroimage","2009","2008/07/08","","","10.1016/j.neuroimage.2008.05.021"
"9344825","Multimodal image coregistration and partitioning--a unified framework","Ashburner J, Friston K.","Neuroimage. 1997 Oct;6(3):209-17. doi: 10.1006/nimg.1997.0290.","Ashburner J","Neuroimage","1997","1997/11/05","","","10.1006/nimg.1997.0290"
"2061481","Plastic transformation of PET images","Friston KJ, Frith CD, Liddle PF, Frackowiak RS.","J Comput Assist Tomogr. 1991 Jul-Aug;15(4):634-9. doi: 10.1097/00004728-199107000-00020.","Friston KJ","J Comput Assist Tomogr","1991","1991/07/01","","","10.1097/00004728-199107000-00020"
"21907810","Decoding episodic memory in ageing: a Bayesian analysis of activity patterns predicting memory","Morcom AM, Friston KJ.","Neuroimage. 2012 Jan 16;59(2):1772-82. doi: 10.1016/j.neuroimage.2011.08.071. Epub 2011 Sep 1.","Morcom AM","Neuroimage","2012","2011/09/13","PMC3236995","","10.1016/j.neuroimage.2011.08.071"
"27045915","The Effects of Low Latency on Pointing and Steering Tasks","Friston S, Karlström P, Steed A.","IEEE Trans Vis Comput Graph. 2016 May;22(5):1605-15. doi: 10.1109/TVCG.2015.2446467.","Friston S","IEEE Trans Vis Comput Graph","2016","2016/04/06","","","10.1109/TVCG.2015.2446467"
"19576931","Dynamic Causal Models for phase coupling","Penny WD, Litvak V, Fuentemilla L, Duzel E, Friston K.","J Neurosci Methods. 2009 Sep 30;183(1):19-30. doi: 10.1016/j.jneumeth.2009.06.029. Epub 2009 Jul 2.","Penny WD","J Neurosci Methods","2009","2009/07/07","PMC2751835","","10.1016/j.jneumeth.2009.06.029"
"30047884","Real-Time Collision Detection for Deformable Characters with Radial Fields","Friston S, Steed A.","IEEE Trans Vis Comput Graph. 2019 Aug;25(8):2611-2622. doi: 10.1109/TVCG.2018.2859924. Epub 2018 Jul 25.","Friston S","IEEE Trans Vis Comput Graph","2019","2018/07/27","","","10.1109/TVCG.2018.2859924"
"12030833","Classical and Bayesian inference in neuroimaging: applications","Friston KJ, Glaser DE, Henson RN, Kiebel S, Phillips C, Ashburner J.","Neuroimage. 2002 Jun;16(2):484-512. doi: 10.1006/nimg.2002.1091.","Friston KJ","Neuroimage","2002","2002/05/29","","","10.1006/nimg.2002.1091"
"34945925","Affect-Logic, Embodiment, Synergetics, and the Free Energy Principle: New Approaches to the Understanding and Treatment of Schizophrenia","Ciompi L, Tschacher W.","Entropy (Basel). 2021 Dec 1;23(12):1619. doi: 10.3390/e23121619.","Ciompi L","Entropy (Basel)","2021","2021/12/24","PMC8700589","","10.3390/e23121619"
"9345546","Transients, metastability, and neuronal dynamics","Friston KJ.","Neuroimage. 1997 Feb;5(2):164-71. doi: 10.1006/nimg.1997.0259.","Friston KJ","Neuroimage","1997","1997/02/01","","","10.1006/nimg.1997.0259"
"9558641","Speed-dependent motion-sensitive responses in V5: an fMRI study","Chawla D, Phillips J, Buechel C, Edwards R, Friston KJ.","Neuroimage. 1998 Feb;7(2):86-96. doi: 10.1006/nimg.1997.0319.","Chawla D","Neuroimage","1998","1998/04/29","","","10.1006/nimg.1997.0319"
"18639641","Electromagnetic source reconstruction for group studies","Litvak V, Friston K.","Neuroimage. 2008 Oct 1;42(4):1490-8. doi: 10.1016/j.neuroimage.2008.06.022. Epub 2008 Jun 27.","Litvak V","Neuroimage","2008","2008/07/22","PMC2581487","","10.1016/j.neuroimage.2008.06.022"
"32617884","Spatial uncertainty improves the distribution of visual attention and the availability of sensory information for conscious report","Lasaponara S, Pinto M, Pellegrino M, Caratelli L, Rossi-Arnaud C, Cestari V, Costanzi M, Doricchi F.","Exp Brain Res. 2020 Sep;238(9):2031-2040. doi: 10.1007/s00221-020-05862-3. Epub 2020 Jul 2.","Lasaponara S","Exp Brain Res","2020","2020/07/04","","","10.1007/s00221-020-05862-3"
"9417976","Incorporating prior knowledge into image registration","Ashburner J, Neelin P, Collins DL, Evans A, Friston K.","Neuroimage. 1997 Nov;6(4):344-52. doi: 10.1006/nimg.1997.0299.","Ashburner J","Neuroimage","1997","1998/02/07","","","10.1006/nimg.1997.0299"
"10096418","Testing for anatomically specified regional effects","Friston KJ.","Hum Brain Mapp. 1997;5(2):133-6. doi: 10.1002/(sici)1097-0193(1997)5:2<133::aid-hbm7>3.0.co;2-4.","Friston KJ","Hum Brain Mapp","1997","1997/01/01","","","10.1002/(sici)1097-0193(1997)5:2<133::aid-hbm7>3.0.co;2-4"
"1553549","Localization of responses to pain in human cerebral cortex","Jones AK, Friston K, Frackowiak RS.","Science. 1992 Jan 10;255(5041):215-6. doi: 10.1126/science.1553549.","Jones AK","Science","1992","1992/01/10","","","10.1126/science.1553549"
"22750569","Dynamic causal modelling of precision and synaptic gain in visual perception - an EEG study","Brown HR, Friston KJ.","Neuroimage. 2012 Oct 15;63(1):223-31. doi: 10.1016/j.neuroimage.2012.06.044. Epub 2012 Jun 29.","Brown HR","Neuroimage","2012","2012/07/04","PMC3438451","","10.1016/j.neuroimage.2012.06.044"
"18790064","Graph-partitioned spatial priors for functional magnetic resonance images","Harrison LM, Penny W, Flandin G, Ruff CC, Weiskopf N, Friston KJ.","Neuroimage. 2008 Dec;43(4):694-707. doi: 10.1016/j.neuroimage.2008.08.012. Epub 2008 Aug 23.","Harrison LM","Neuroimage","2008","2008/09/16","PMC2643838","UKMS3874","10.1016/j.neuroimage.2008.08.012"
"18080131","Attractor models of working memory and their modulation by reward","Chumbley JR, Dolan RJ, Friston KJ.","Biol Cybern. 2008 Jan;98(1):11-8. doi: 10.1007/s00422-007-0202-0. Epub 2007 Dec 14.","Chumbley JR","Biol Cybern","2008","2007/12/15","PMC2642585","UKMS3884","10.1007/s00422-007-0202-0"
"27471478","Free Energy and Virtual Reality in Neuroscience and Psychoanalysis: A Complexity Theory of Dreaming and Mental Disorder","Hopkins J.","Front Psychol. 2016 Jul 15;7:922. doi: 10.3389/fpsyg.2016.00922. eCollection 2016.","Hopkins J","Front Psychol","2016","2016/07/30","PMC4946392","","10.3389/fpsyg.2016.00922"
"15896570","Information theory, novelty and hippocampal responses: unpredicted or unpredictable?","Strange BA, Duggins A, Penny W, Dolan RJ, Friston KJ.","Neural Netw. 2005 Apr;18(3):225-30. doi: 10.1016/j.neunet.2004.12.004. Epub 2005 Mar 19.","Strange BA","Neural Netw","2005","2005/05/18","","","10.1016/j.neunet.2004.12.004"
"24578041","Assessing the significance of focal activations using their spatial extent","Friston KJ, Worsley KJ, Frackowiak RS, Mazziotta JC, Evans AC.","Hum Brain Mapp. 1994;1(3):210-20. doi: 10.1002/hbm.460010306.","Friston KJ","Hum Brain Mapp","1994","2014/03/01","","","10.1002/hbm.460010306"
"10377795","[SPM analysis on PET and SPECT data]","Fukuyama H.","Rinsho Shinkeigaku. 1999 Jan;39(1):36-8.","Fukuyama H","Rinsho Shinkeigaku","1999","1999/06/23","","",""
"2498958","Lithium increases slow wave sleep: possible mediation by brain 5-HT2 receptors?","Friston KJ, Sharpley AL, Solomon RA, Cowen PJ.","Psychopharmacology (Berl). 1989;98(1):139-40. doi: 10.1007/BF00442020.","Friston KJ","Psychopharmacology (Berl)","1989","1989/01/01","","","10.1007/BF00442020"
"27903727","Predicting ""When"" in Discourse Engages the Human Dorsal Auditory Stream: An fMRI Study Using Naturalistic Stories","Kandylaki KD, Nagels A, Tune S, Kircher T, Wiese R, Schlesewsky M, Bornkessel-Schlesewsky I.","J Neurosci. 2016 Nov 30;36(48):12180-12191. doi: 10.1523/JNEUROSCI.4100-15.2016.","Kandylaki KD","J Neurosci","2016","2016/12/02","PMC5148219","","10.1523/JNEUROSCI.4100-15.2016"
"9668657","Psychosis and the experience of self. Brain systems underlying self-monitoring","Frith C, Rees G, Friston K.","Ann N Y Acad Sci. 1998 May 15;843:170-8. doi: 10.1111/j.1749-6632.1998.tb08213.x.","Frith C","Ann N Y Acad Sci","1998","1998/07/21","","","10.1111/j.1749-6632.1998.tb08213.x"
"8265675","Principal component analysis learning algorithms: a neurobiological analysis","Friston KJ, Frith CD, Frackowiak RS.","Proc Biol Sci. 1993 Oct 22;254(1339):47-54. doi: 10.1098/rspb.1993.0125.","Friston KJ","Proc Biol Sci","1993","1993/10/22","","","10.1098/rspb.1993.0125"
"8978390","Analysis of dynamic radioligand displacement or ""activation"" studies","Friston KJ, Malizia AL, Wilson S, Cunningham VJ, Jones T, Nutt DJ.","J Cereb Blood Flow Metab. 1997 Jan;17(1):80-93. doi: 10.1097/00004647-199701000-00011.","Friston KJ","J Cereb Blood Flow Metab","1997","1997/01/01","","","10.1097/00004647-199701000-00011"
"8952093","The neural regions sustaining object recognition and naming","Price CJ, Moore CJ, Humphreys GW, Frackowiak RS, Friston KJ.","Proc Biol Sci. 1996 Nov 22;263(1376):1501-7. doi: 10.1098/rspb.1996.0219.","Price CJ","Proc Biol Sci","1996","1996/11/22","","","10.1098/rspb.1996.0219"
"12169248","A model of the hemodynamic response and oxygen delivery to brain","Zheng Y, Martindale J, Johnston D, Jones M, Berwick J, Mayhew J.","Neuroimage. 2002 Jul;16(3 Pt 1):617-37. doi: 10.1006/nimg.2002.1078.","Zheng Y","Neuroimage","2002","2002/08/10","","","10.1006/nimg.2002.1078"
"26192103","Commentary on ""Autism, oxytocin and interoception"": Alexithymia, not Autism Spectrum Disorders, is the consequence of interoceptive failure","Brewer R, Happé F, Cook R, Bird G.","Neurosci Biobehav Rev. 2015 Sep;56:348-53. doi: 10.1016/j.neubiorev.2015.07.006. Epub 2015 Jul 17.","Brewer R","Neurosci Biobehav Rev","2015","2015/07/21","","","10.1016/j.neubiorev.2015.07.006"
"20408193","A multivariate analysis of PET activation studies","Friston KJ, Poline JB, Holmes AP, Frith CD, Frackowiak RS.","Hum Brain Mapp. 1996;4(2):140-51. doi: 10.1002/(SICI)1097-0193(1996)4:2<140::AID-HBM5>3.0.CO;2-3.","Friston KJ","Hum Brain Mapp","1996","2010/04/22","","","10.1002/(SICI)1097-0193(1996)4:2<140::AID-HBM5>3.0.CO;2-3"
"12880849","Posterior probability maps and SPMs","Friston KJ, Penny W.","Neuroimage. 2003 Jul;19(3):1240-9. doi: 10.1016/s1053-8119(03)00144-7.","Friston KJ","Neuroimage","2003","2003/07/26","","","10.1016/s1053-8119(03)00144-7"
"7713993","Commentary and opinion: II. Statistical parametric mapping: ontology and current issues","Friston KJ.","J Cereb Blood Flow Metab. 1995 May;15(3):361-70. doi: 10.1038/jcbfm.1995.45.","Friston KJ","J Cereb Blood Flow Metab","1995","1995/05/01","","","10.1038/jcbfm.1995.45"
"9620699","Brain systems mediating aversive conditioning: an event-related fMRI study","Büchel C, Morris J, Dolan RJ, Friston KJ.","Neuron. 1998 May;20(5):947-57. doi: 10.1016/s0896-6273(00)80476-6.","Büchel C","Neuron","1998","1998/06/10","","","10.1016/s0896-6273(00)80476-6"
"18602841","The functional anatomy of the MMN: a DCM study of the roving paradigm","Garrido MI, Friston KJ, Kiebel SJ, Stephan KE, Baldeweg T, Kilner JM.","Neuroimage. 2008 Aug 15;42(2):936-44. doi: 10.1016/j.neuroimage.2008.05.018. Epub 2008 May 20.","Garrido MI","Neuroimage","2008","2008/07/08","PMC2640481","UKMS3855","10.1016/j.neuroimage.2008.05.018"
"20526410","Models of functional neuroimaging data","Stephan KE, Mattout J, David O, Friston KJ.","Curr Med Imaging Rev. 2006 Feb;2(1):15-34. doi: 10.2174/157340506775541659.","Stephan KE","Curr Med Imaging Rev","2006","2010/06/08","PMC2880445","UKMS3825","10.2174/157340506775541659"
"9343601","Tests for distributed, nonfocal brain activations","Worsley KJ, Poline JB, Vandal AC, Friston KJ.","Neuroimage. 1995 Sep;2(3):183-94. doi: 10.1006/nimg.1995.1024.","Worsley KJ","Neuroimage","1995","1995/09/01","","","10.1006/nimg.1995.1024"
"17616402","Spatial normalization of lesioned brains: performance evaluation and impact on fMRI analyses","Crinion J, Ashburner J, Leff A, Brett M, Price C, Friston K.","Neuroimage. 2007 Sep 1;37(3):866-75. doi: 10.1016/j.neuroimage.2007.04.065. Epub 2007 May 24.","Crinion J","Neuroimage","2007","2007/07/10","PMC3223520","","10.1016/j.neuroimage.2007.04.065"
"16635578","Divide and conquer: a defense of functional localizers","Saxe R, Brett M, Kanwisher N.","Neuroimage. 2006 May 1;30(4):1088-96; discussion 1097-9. doi: 10.1016/j.neuroimage.2005.12.062. Epub 2006 Apr 24.","Saxe R","Neuroimage","2006","2006/04/26","","","10.1016/j.neuroimage.2005.12.062"
"1681197","Sites of action of morphine in the brain","Jones AK, Friston KJ, Qi LY, Harris M, Cunningham VJ, Jones T, Feinman C, Frackowiak RS.","Lancet. 1991 Sep 28;338(8770):825. doi: 10.1016/0140-6736(91)90717-4.","Jones AK","Lancet","1991","1991/09/28","","","10.1016/0140-6736(91)90717-4"
"8417010","Functional connectivity: the principal-component analysis of large (PET) data sets","Friston KJ, Frith CD, Liddle PF, Frackowiak RS.","J Cereb Blood Flow Metab. 1993 Jan;13(1):5-14. doi: 10.1038/jcbfm.1993.4.","Friston KJ","J Cereb Blood Flow Metab","1993","1993/01/01","","","10.1038/jcbfm.1993.4"
"19770049","Dynamic causal modeling and Granger causality Comments on: the identification of interacting networks in the brain using fMRI: model selection, causality and deconvolution","Friston K.","Neuroimage. 2011 Sep 15;58(2):303-5; author reply 310-1. doi: 10.1016/j.neuroimage.2009.09.031. Epub 2009 Sep 19.","Friston K","Neuroimage","2011","2009/09/23","PMC3183826","","10.1016/j.neuroimage.2009.09.031"
"1354360","Motor practice and neurophysiological adaptation in the cerebellum: a positron tomography study","Friston KJ, Frith CD, Passingham RE, Liddle PF, Frackowiak RS.","Proc Biol Sci. 1992 Jun 22;248(1323):223-8. doi: 10.1098/rspb.1992.0065.","Friston KJ","Proc Biol Sci","1992","1992/06/22","","","10.1098/rspb.1992.0065"
"11530376","[Brain function and local anatomy for SPM analysis]","Miyashita K.","Kaku Igaku. 2001 Jul;38(4):301-7.","Miyashita K","Kaku Igaku","2001","2001/09/04","","",""
"14527620","A heuristic for the degrees of freedom of statistics based on multiple variance parameters","Kiebel SJ, Glaser DE, Friston KJ.","Neuroimage. 2003 Sep;20(1):591-600. doi: 10.1016/s1053-8119(03)00308-2.","Kiebel SJ","Neuroimage","2003","2003/10/07","","","10.1016/s1053-8119(03)00308-2"
"10066177","The predictive value of changes in effective connectivity for human learning","Büchel C, Coull JT, Friston KJ.","Science. 1999 Mar 5;283(5407):1538-41. doi: 10.1126/science.283.5407.1538.","Büchel C","Science","1999","1999/03/05","","","10.1126/science.283.5407.1538"
"9345487","A multivariate analysis of evoked responses in EEG and MEG data","Friston KJ, Stephan KM, Heather JD, Frith CD, Ioannides AA, Liu LC, Rugg MD, Vieth J, Keber H, Hunter K, Frackowiak RS.","Neuroimage. 1996 Jun;3(3 Pt 1):167-74. doi: 10.1006/nimg.1996.0018.","Friston KJ","Neuroimage","1996","1996/06/01","","","10.1006/nimg.1996.0018"
"17462916","Dynamic causal modelling of evoked responses: the role of intrinsic connections","Kiebel SJ, Garrido MI, Friston KJ.","Neuroimage. 2007 Jun;36(2):332-45. doi: 10.1016/j.neuroimage.2007.02.046. Epub 2007 Mar 13.","Kiebel SJ","Neuroimage","2007","2007/04/28","","","10.1016/j.neuroimage.2007.02.046"
"9358440","Lateral geniculate activations can be detected using intersubject averaging and fMRI","Büchel C, Turner R, Friston K.","Magn Reson Med. 1997 Nov;38(5):691-4. doi: 10.1002/mrm.1910380502.","Büchel C","Magn Reson Med","1997","1997/11/14","","","10.1002/mrm.1910380502"
"15929085","Parametric analysis of oscillatory activity as measured with EEG/MEG","Kiebel SJ, Tallon-Baudry C, Friston KJ.","Hum Brain Mapp. 2005 Nov;26(3):170-7. doi: 10.1002/hbm.20153.","Kiebel SJ","Hum Brain Mapp","2005","2005/06/02","PMC6871741","","10.1002/hbm.20153"
"12781739","Modeling regional and psychophysiologic interactions in fMRI: the importance of hemodynamic deconvolution","Gitelman DR, Penny WD, Ashburner J, Friston KJ.","Neuroimage. 2003 May;19(1):200-7. doi: 10.1016/s1053-8119(03)00058-2.","Gitelman DR","Neuroimage","2003","2003/06/05","","","10.1016/s1053-8119(03)00058-2"
"8670646","Functional topography: multidimensional scaling and functional connectivity in the brain","Friston KJ, Frith CD, Fletcher P, Liddle PF, Frackowiak RS.","Cereb Cortex. 1996 Mar-Apr;6(2):156-64. doi: 10.1093/cercor/6.2.156.","Friston KJ","Cereb Cortex","1996","1996/03/01","","","10.1093/cercor/6.2.156"
"1606474","The left medial temporal region and schizophrenia. A PET study","Friston KJ, Liddle PF, Frith CD, Hirsch SR, Frackowiak RS.","Brain. 1992 Apr;115 ( Pt 2):367-82. doi: 10.1093/brain/115.2.367.","Friston KJ","Brain","1992","1992/04/01","","","10.1093/brain/115.2.367"
"1354845","Measuring the neuromodulatory effects of drugs in man with positron emission tomography","Friston KJ, Grasby PM, Bench CJ, Frith CD, Cowen PJ, Liddle PF, Frackowiak RS, Dolan R.","Neurosci Lett. 1992 Jul 6;141(1):106-10. doi: 10.1016/0304-3940(92)90345-8.","Friston KJ","Neurosci Lett","1992","1992/07/06","","","10.1016/0304-3940(92)90345-8"
"20408186","A unified statistical approach for determining significant signals in images of cerebral activation","Worsley KJ, Marrett S, Neelin P, Vandal AC, Friston KJ, Evans AC.","Hum Brain Mapp. 1996;4(1):58-73. doi: 10.1002/(SICI)1097-0193(1996)4:1<58::AID-HBM4>3.0.CO;2-O.","Worsley KJ","Hum Brain Mapp","1996","2010/04/22","","","10.1002/(SICI)1097-0193(1996)4:1<58::AID-HBM4>3.0.CO;2-O"
"2050758","Comparing functional (PET) images: the assessment of significant change","Friston KJ, Frith CD, Liddle PF, Frackowiak RS.","J Cereb Blood Flow Metab. 1991 Jul;11(4):690-9. doi: 10.1038/jcbfm.1991.122.","Friston KJ","J Cereb Blood Flow Metab","1991","1991/07/01","","","10.1038/jcbfm.1991.122"
"9685156","A multimodal language region in the ventral visual pathway","Büchel C, Price C, Friston K.","Nature. 1998 Jul 16;394(6690):274-7. doi: 10.1038/28389.","Büchel C","Nature","1998","1998/07/31","","","10.1038/28389"
"9345556","MRI and PET coregistration--a cross validation of statistical parametric mapping and automated image registration","Kiebel SJ, Ashburner J, Poline JB, Friston KJ.","Neuroimage. 1997 May;5(4 Pt 1):271-9. doi: 10.1006/nimg.1997.0265.","Kiebel SJ","Neuroimage","1997","1997/05/01","","","10.1006/nimg.1997.0265"
"18603003","Bayesian deconvolution of [corrected] fMRI data using bilinear dynamical systems","Makni S, Beckmann C, Smith S, Woolrich M.","Neuroimage. 2008 Oct 1;42(4):1381-96. doi: 10.1016/j.neuroimage.2008.05.052. Epub 2008 Jun 6.","Makni S","Neuroimage","2008","2008/07/08","","","10.1016/j.neuroimage.2008.05.052"
"2789231","Localisation in PET images: direct fitting of the intercommissural (AC-PC) line","Friston KJ, Passingham RE, Nutt JG, Heather JD, Sawle GV, Frackowiak RS.","J Cereb Blood Flow Metab. 1989 Oct;9(5):690-5. doi: 10.1038/jcbfm.1989.97.","Friston KJ","J Cereb Blood Flow Metab","1989","1989/10/01","","","10.1038/jcbfm.1989.97"
