PMID,Title,Authors,Citation,First Author,Journal/Book,Publication Year,Create Date,PMCID,NIHMS ID,DOI
"9770548","Neural basis of an inherited speech and language disorder","Vargha-Khadem F, Watkins KE, Price CJ, Ashburner J, Alcock KJ, Connelly A, Frackowiak RS, Friston KJ, Pembrey ME, Mishkin M, Gadian DG, Passingham RE.","Proc Natl Acad Sci U S A. 1998 Oct 13;95(21):12695-700. doi: 10.1073/pnas.95.21.12695.","Vargha-Khadem F","Proc Natl Acad Sci U S A","1998","1998/10/15","PMC22893","","10.1073/pnas.95.21.12695"
"37080424","Cognitive effort and active inference","Parr T, Holmes E, Friston KJ, Pezzulo G.","Neuropsychologia. 2023 Jun 6;184:108562. doi: 10.1016/j.neuropsychologia.2023.108562. Epub 2023 Apr 18.","Parr T","Neuropsychologia","2023","2023/04/20","","","10.1016/j.neuropsychologia.2023.108562"
"35618044","A free energy principle for generic quantum systems","Fields C, Friston K, Glazebrook JF, Levin M.","Prog Biophys Mol Biol. 2022 Sep;173:36-59. doi: 10.1016/j.pbiomolbio.2022.05.006. Epub 2022 May 23.","Fields C","Prog Biophys Mol Biol","2022","2022/05/26","","","10.1016/j.pbiomolbio.2022.05.006"
"35327872","How Active Inference Could Help Revolutionise Robotics","Da Costa L, Lanillos P, Sajid N, Friston K, Khan S.","Entropy (Basel). 2022 Mar 2;24(3):361. doi: 10.3390/e24030361.","Da Costa L","Entropy (Basel)","2022","2022/03/25","PMC8946999","","10.3390/e24030361"
"34457352","Towards a computational phenomenology of mental action: modelling meta-awareness and attentional control with deep parametric active inference","Sandved-Smith L, Hesp C, Mattout J, Friston K, Lutz A, Ramstead MJD.","Neurosci Conscious. 2021 Aug 27;2021(2):niab018. doi: 10.1093/nc/niab018. eCollection 2021.","Sandved-Smith L","Neurosci Conscious","2021","2021/08/30","PMC8396119","","10.1093/nc/niab018"
"33607182","Markov blankets in the brain","Hipólito I, Ramstead MJD, Convertino L, Bhat A, Friston K, Parr T.","Neurosci Biobehav Rev. 2021 Jun;125:88-97. doi: 10.1016/j.neubiorev.2021.02.003. Epub 2021 Feb 16.","Hipólito I","Neurosci Biobehav Rev","2021","2021/02/19","PMC8373616","","10.1016/j.neubiorev.2021.02.003"
"29111409","MULAN: Evaluation and ensemble statistical inference for functional connectivity","Wang HE, Friston KJ, Bénar CG, Woodman MM, Chauvel P, Jirsa V, Bernard C.","Neuroimage. 2018 Feb 1;166:167-184. doi: 10.1016/j.neuroimage.2017.10.036. Epub 2017 Oct 27.","Wang HE","Neuroimage","2018","2017/11/08","","","10.1016/j.neuroimage.2017.10.036"
"22125485","Optimizing experimental design for comparing models of brain function","Daunizeau J, Preuschoff K, Friston K, Stephan K.","PLoS Comput Biol. 2011 Nov;7(11):e1002280. doi: 10.1371/journal.pcbi.1002280. Epub 2011 Nov 17.","Daunizeau J","PLoS Comput Biol","2011","2011/11/30","PMC3219623","","10.1371/journal.pcbi.1002280"
"21976523","Effective connectivity during processing of facial affect: evidence for multiple parallel pathways","Dima D, Stephan KE, Roiser JP, Friston KJ, Frangou S.","J Neurosci. 2011 Oct 5;31(40):14378-85. doi: 10.1523/JNEUROSCI.2400-11.2011.","Dima D","J Neurosci","2011","2011/10/07","PMC6623650","","10.1523/JNEUROSCI.2400-11.2011"
"20369004","Predictive coding or evidence accumulation? False inference and neuronal fluctuations","Hesselmann G, Sadaghiani S, Friston KJ, Kleinschmidt A.","PLoS One. 2010 Mar 29;5(3):e9926. doi: 10.1371/journal.pone.0009926.","Hesselmann G","PLoS One","2010","2010/04/07","PMC2848028","","10.1371/journal.pone.0009926"
"19641120","Encoding of marginal utility across time in the human brain","Pine A, Seymour B, Roiser JP, Bossaerts P, Friston KJ, Curran HV, Dolan RJ.","J Neurosci. 2009 Jul 29;29(30):9575-81. doi: 10.1523/JNEUROSCI.1126-09.2009.","Pine A","J Neurosci","2009","2009/07/31","PMC2816907","UKMS28699","10.1523/JNEUROSCI.1126-09.2009"
"17542641","Hierarchical processing of auditory objects in humans","Kumar S, Stephan KE, Warren JD, Friston KJ, Griffiths TD.","PLoS Comput Biol. 2007 Jun;3(6):e100. doi: 10.1371/journal.pcbi.0030100. Epub 2007 Apr 24.","Kumar S","PLoS Comput Biol","2007","2007/06/05","PMC1885275","","10.1371/journal.pcbi.0030100"
"9417970","Characterizing the relationship between BOLD contrast and regional cerebral blood flow measurements by varying the stimulus presentation rate","Rees G, Howseman A, Josephs O, Frith CD, Friston KJ, Frackowiak RS, Turner R.","Neuroimage. 1997 Nov;6(4):270-8. doi: 10.1006/nimg.1997.0300.","Rees G","Neuroimage","1997","1998/02/07","","","10.1006/nimg.1997.0300"
"8931589","Cerebral benzodiazepine receptors in hippocampal sclerosis. An objective in vivo analysis","Koepp MJ, Richardson MP, Brooks DJ, Poline JB, Van Paesschen W, Friston KJ, Duncan JS.","Brain. 1996 Oct;119 ( Pt 5):1677-87. doi: 10.1093/brain/119.5.1677.","Koepp MJ","Brain","1996","1996/10/01","","","10.1093/brain/119.5.1677"
"8270929","Dorsolateral prefrontal cortex dysfunction in the major psychoses; symptom or disease specificity?","Dolan RJ, Bench CJ, Liddle PF, Friston KJ, Frith CD, Grasby PM, Frackowiak RS.","J Neurol Neurosurg Psychiatry. 1993 Dec;56(12):1290-4. doi: 10.1136/jnnp.56.12.1290.","Dolan RJ","J Neurol Neurosurg Psychiatry","1993","1993/12/01","PMC1015376","","10.1136/jnnp.56.12.1290"
"2065746","Cortical areas and the selection of movement: a study with positron emission tomography","Deiber MP, Passingham RE, Colebatch JG, Friston KJ, Nixon PD, Frackowiak RS.","Exp Brain Res. 1991;84(2):393-402. doi: 10.1007/BF00231461.","Deiber MP","Exp Brain Res","1991","1991/01/01","","","10.1007/BF00231461"
"32410974","Changes in the Effective Connectivity of the Social Brain When Making Inferences About Close Others vs. the Self","Esménio S, Soares JM, Oliveira-Silva P, Gonçalves ÓF, Friston K, Fernandes Coutinho J.","Front Hum Neurosci. 2020 Apr 29;14:151. doi: 10.3389/fnhum.2020.00151. eCollection 2020.","Esménio S","Front Hum Neurosci","2020","2020/05/16","PMC7202326","","10.3389/fnhum.2020.00151"
"8824341","Local and distributed effects of apomorphine on fronto-temporal function in acute unmedicated schizophrenia","Fletcher PC, Frith CD, Grasby PM, Friston KJ, Dolan RJ.","J Neurosci. 1996 Nov 1;16(21):7055-62. doi: 10.1523/JNEUROSCI.16-21-07055.1996.","Fletcher PC","J Neurosci","1996","1996/11/01","PMC6579275","","10.1523/JNEUROSCI.16-21-07055.1996"
"7901863","Regional cerebral blood flow in depression measured by positron emission tomography: the relationship with clinical dimensions","Bench CJ, Friston KJ, Brown RG, Frackowiak RS, Dolan RJ.","Psychol Med. 1993 Aug;23(3):579-90. doi: 10.1017/s0033291700025368.","Bench CJ","Psychol Med","1993","1993/08/01","","","10.1017/s0033291700025368"
"36786123","The case for complement component 5 as a target in neurodegenerative disease","Stennett A, Friston K, Harris CL, Wollman AJM, Bronowska AK, Madden KS.","Expert Opin Ther Targets. 2023 Feb;27(2):97-109. doi: 10.1080/14728222.2023.2177532. Epub 2023 Feb 17.","Stennett A","Expert Opin Ther Targets","2023","2023/02/14","","","10.1080/14728222.2023.2177532"
"30429814","Rapid Eye Movements in Sleep Furnish a Unique Probe Into Consciousness","Hong CC, Fallon JH, Friston KJ, Harris JC.","Front Psychol. 2018 Oct 31;9:2087. doi: 10.3389/fpsyg.2018.02087. eCollection 2018.","Hong CC","Front Psychol","2018","2018/11/16","PMC6220670","","10.3389/fpsyg.2018.02087"
"29528293","Clinical Applications of Stochastic Dynamic Models of the Brain, Part I: A Primer","Roberts JA, Friston KJ, Breakspear M.","Biol Psychiatry Cogn Neurosci Neuroimaging. 2017 Apr;2(3):216-224. doi: 10.1016/j.bpsc.2017.01.010. Epub 2017 Feb 7.","Roberts JA","Biol Psychiatry Cogn Neurosci Neuroimaging","2017","2018/03/13","","","10.1016/j.bpsc.2017.01.010"
"23153964","Basal ganglia-cortical interactions in Parkinsonian patients","Marreiros AC, Cagnan H, Moran RJ, Friston KJ, Brown P.","Neuroimage. 2013 Feb 1;66:301-10. doi: 10.1016/j.neuroimage.2012.10.088. Epub 2012 Nov 13.","Marreiros AC","Neuroimage","2013","2012/11/17","PMC3573233","","10.1016/j.neuroimage.2012.10.088"
"22730072","Tracking changes following spinal cord injury: insights from neuroimaging","Freund P, Curt A, Friston K, Thompson A.","Neuroscientist. 2013 Apr;19(2):116-28. doi: 10.1177/1073858412449192. Epub 2012 Jun 22.","Freund P","Neuroscientist","2013","2012/06/26","PMC4107798","","10.1177/1073858412449192"
"21629826","A bayesian foundation for individual learning under uncertainty","Mathys C, Daunizeau J, Friston KJ, Stephan KE.","Front Hum Neurosci. 2011 May 2;5:39. doi: 10.3389/fnhum.2011.00039. eCollection 2011.","Mathys C","Front Hum Neurosci","2011","2011/06/02","PMC3096853","","10.3389/fnhum.2011.00039"
"10078733","Kallmann's syndrome: mirror movements associated with bilateral corticospinal tract hypertrophy","Krams M, Quinton R, Ashburner J, Friston KJ, Frackowiak RS, Bouloux PM, Passingham RE.","Neurology. 1999 Mar 10;52(4):816-22. doi: 10.1212/wnl.52.4.816.","Krams M","Neurology","1999","1999/03/17","","","10.1212/wnl.52.4.816"
"35340847","A step-by-step tutorial on active inference and its application to empirical data","Smith R, Friston KJ, Whyte CJ.","J Math Psychol. 2022 Apr;107:102632. doi: 10.1016/j.jmp.2021.102632. Epub 2022 Feb 4.","Smith R","J Math Psychol","2022","2022/03/28","PMC8956124","NIHMS1763153","10.1016/j.jmp.2021.102632"
"34386910","Rendering neuronal state equations compatible with the principle of stationary action","Fagerholm ED, Foulkes WMC, Friston KJ, Moran RJ, Leech R.","J Math Neurosci. 2021 Aug 12;11(1):10. doi: 10.1186/s13408-021-00108-0.","Fagerholm ED","J Math Neurosci","2021","2021/08/13","PMC8360977","","10.1186/s13408-021-00108-0"
"30738997","The role of the hippocampus in weighting expectations during inference under uncertainty","Rigoli F, Michely J, Friston KJ, Dolan RJ.","Cortex. 2019 Jun;115:1-14. doi: 10.1016/j.cortex.2019.01.005. Epub 2019 Jan 23.","Rigoli F","Cortex","2019","2019/02/11","PMC6533111","","10.1016/j.cortex.2019.01.005"
"30535098","Recovery after stroke: not so proportional after all?","Hope TMH, Friston K, Price CJ, Leff AP, Rotshtein P, Bowman H.","Brain. 2019 Jan 1;142(1):15-22. doi: 10.1093/brain/awy302.","Hope TMH","Brain","2019","2018/12/12","PMC6308308","","10.1093/brain/awy302"
"28044016","Is predictability salient? A study of attentional capture by auditory patterns","Southwell R, Baumann A, Gal C, Barascud N, Friston K, Chait M.","Philos Trans R Soc Lond B Biol Sci. 2017 Feb 19;372(1714):20160105. doi: 10.1098/rstb.2016.0105. Epub 2017 Jan 2.","Southwell R","Philos Trans R Soc Lond B Biol Sci","2017","2017/01/04","PMC5206273","","10.1098/rstb.2016.0105"
"25983690","Simultaneous learning and filtering without delusions: a Bayes-optimal combination of Predictive Inference and Adaptive Filtering","Kneissler J, Drugowitsch J, Friston K, Butz MV.","Front Comput Neurosci. 2015 Apr 30;9:47. doi: 10.3389/fncom.2015.00047. eCollection 2015.","Kneissler J","Front Comput Neurosci","2015","2015/05/19","PMC4415408","","10.3389/fncom.2015.00047"
"23322402","Spatial attention, precision, and Bayesian inference: a study of saccadic response speed","Vossel S, Mathys C, Daunizeau J, Bauer M, Driver J, Friston KJ, Stephan KE.","Cereb Cortex. 2014 Jun;24(6):1436-50. doi: 10.1093/cercor/bhs418. Epub 2013 Jan 14.","Vossel S","Cereb Cortex","2014","2013/01/17","PMC4014178","","10.1093/cercor/bhs418"
"21471558","Ongoing brain activity fluctuations directly account for intertrial and indirectly for intersubject variability in Stroop task performance","Coste CP, Sadaghiani S, Friston KJ, Kleinschmidt A.","Cereb Cortex. 2011 Nov;21(11):2612-9. doi: 10.1093/cercor/bhr050. Epub 2011 Apr 6.","Coste CP","Cereb Cortex","2011","2011/04/08","","","10.1093/cercor/bhr050"
"20093150","Modelling event-related skin conductance responses","Bach DR, Flandin G, Friston KJ, Dolan RJ.","Int J Psychophysiol. 2010 Mar;75(3):349-56. doi: 10.1016/j.ijpsycho.2010.01.005. Epub 2010 Jan 20.","Bach DR","Int J Psychophysiol","2010","2010/01/23","PMC2877881","","10.1016/j.ijpsycho.2010.01.005"
"9345495","Reproducibility of PET activation studies: lessons from a multi-center European experiment. EU concerted action on functional imaging","Poline JB, Vandenberghe R, Holmes AP, Friston KJ, Frackowiak RS.","Neuroimage. 1996 Aug;4(1):34-54. doi: 10.1006/nimg.1996.0027.","Poline JB","Neuroimage","1996","1996/08/01","","","10.1006/nimg.1996.0027"
"1523287","Effect of the 5-HT1A partial agonist buspirone on regional cerebral blood flow in man","Grasby PM, Friston KJ, Bench C, Cowen PJ, Frith CD, Liddle PF, Frackowiak RS, Dolan RJ.","Psychopharmacology (Berl). 1992;108(3):380-6. doi: 10.1007/BF02245127.","Grasby PM","Psychopharmacology (Berl)","1992","1992/01/01","","","10.1007/BF02245127"
"36923275","Therapeutic touch and therapeutic alliance in pediatric care and neonatology: An active inference framework","McParlin Z, Cerritelli F, Manzotti A, Friston KJ, Esteves JE.","Front Pediatr. 2023 Feb 27;11:961075. doi: 10.3389/fped.2023.961075. eCollection 2023.","McParlin Z","Front Pediatr","2023","2023/03/16","PMC10009260","","10.3389/fped.2023.961075"
"32055104","Caching mechanisms for habit formation in Active Inference","Maisto D, Friston K, Pezzulo G.","Neurocomputing (Amst). 2019 Sep 24;359:298-314. doi: 10.1016/j.neucom.2019.05.083.","Maisto D","Neurocomputing (Amst)","2019","2020/02/15","PMC7001981","","10.1016/j.neucom.2019.05.083"
"28226255","Action perception as hypothesis testing","Donnarumma F, Costantini M, Ambrosini E, Friston K, Pezzulo G.","Cortex. 2017 Apr;89:45-60. doi: 10.1016/j.cortex.2017.01.016. Epub 2017 Jan 31.","Donnarumma F","Cortex","2017","2017/02/23","PMC5383736","","10.1016/j.cortex.2017.01.016"
"25170795","Sensory processing and the rubber hand illusion--an evoked potentials study","Zeller D, Litvak V, Friston KJ, Classen J.","J Cogn Neurosci. 2015 Mar;27(3):573-82. doi: 10.1162/jocn_a_00705. Epub 2014 Aug 29.","Zeller D","J Cogn Neurosci","2015","2014/08/30","","","10.1162/jocn_a_00705"
"24445167","A brain basis for musical hallucinations","Kumar S, Sedley W, Barnes GR, Teki S, Friston KJ, Griffiths TD.","Cortex. 2014 Mar;52(100):86-97. doi: 10.1016/j.cortex.2013.12.002. Epub 2013 Dec 17.","Kumar S","Cortex","2014","2014/01/22","PMC3969291","","10.1016/j.cortex.2013.12.002"
"23749500","Anterior insular cortex and emotional awareness","Gu X, Hof PR, Friston KJ, Fan J.","J Comp Neurol. 2013 Oct 15;521(15):3371-88. doi: 10.1002/cne.23368.","Gu X","J Comp Neurol","2013","2013/06/11","PMC3999437","NIHMS569906","10.1002/cne.23368"
"21867760","The danger of systematic bias in group-level FMRI-lag-based causality estimation","Smith SM, Bandettini PA, Miller KL, Behrens TE, Friston KJ, David O, Liu T, Woolrich MW, Nichols TE.","Neuroimage. 2012 Jan 16;59(2):1228-9. doi: 10.1016/j.neuroimage.2011.08.015. Epub 2011 Aug 16.","Smith SM","Neuroimage","2012","2011/08/27","","","10.1016/j.neuroimage.2011.08.015"
"10860798","Variability in fMRI: an examination of intersession differences","McGonigle DJ, Howseman AM, Athwal BS, Friston KJ, Frackowiak RS, Holmes AP.","Neuroimage. 2000 Jun;11(6 Pt 1):708-34. doi: 10.1006/nimg.2000.0562.","McGonigle DJ","Neuroimage","2000","2000/06/22","","","10.1006/nimg.2000.0562"
"10600416","Noradrenergically mediated plasticity in a human attentional neuronal network","Coull JT, Büchel C, Friston KJ, Frith CD.","Neuroimage. 1999 Dec;10(6):705-15. doi: 10.1006/nimg.1999.0513.","Coull JT","Neuroimage","1999","1999/12/22","","","10.1006/nimg.1999.0513"
"1410086","The anatomy of melancholia--focal abnormalities of cerebral blood flow in major depression","Bench CJ, Friston KJ, Brown RG, Scott LC, Frackowiak RS, Dolan RJ.","Psychol Med. 1992 Aug;22(3):607-15. doi: 10.1017/s003329170003806x.","Bench CJ","Psychol Med","1992","1992/08/01","","","10.1017/s003329170003806x"
"8822570","Positron emission tomography study of voluntary saccadic eye movements and spatial working memory","Sweeney JA, Mintun MA, Kwee S, Wiseman MB, Brown DL, Rosenberg DR, Carl JR.","J Neurophysiol. 1996 Jan;75(1):454-68. doi: 10.1152/jn.1996.75.1.454.","Sweeney JA","J Neurophysiol","1996","1996/01/01","","","10.1152/jn.1996.75.1.454"
"33096824","Neuromodulatory Control and Language Recovery in Bilingual Aphasia: An Active Inference Approach","Sajid N, Friston KJ, Ekert JO, Price CJ, W Green D.","Behav Sci (Basel). 2020 Oct 21;10(10):161. doi: 10.3390/bs10100161.","Sajid N","Behav Sci (Basel)","2020","2020/10/24","PMC7588909","","10.3390/bs10100161"
"27506256","Bridging the Gap: Dynamic Causal Modeling and Granger Causality Analysis of Resting State Functional Magnetic Resonance Imaging","Bajaj S, Adhikari BM, Friston KJ, Dhamala M.","Brain Connect. 2016 Oct;6(8):652-661. doi: 10.1089/brain.2016.0422. Epub 2016 Sep 16.","Bajaj S","Brain Connect","2016","2016/08/11","","","10.1089/brain.2016.0422"
"27241481","Dynamic causal modeling of touch-evoked potentials in the rubber hand illusion","Zeller D, Friston KJ, Classen J.","Neuroimage. 2016 Sep;138:266-273. doi: 10.1016/j.neuroimage.2016.05.065. Epub 2016 May 27.","Zeller D","Neuroimage","2016","2016/06/01","","","10.1016/j.neuroimage.2016.05.065"
"26189566","Neuroticism and conscientiousness respectively constrain and facilitate short-term plasticity within the working memory neural network","Dima D, Friston KJ, Stephan KE, Frangou S.","Hum Brain Mapp. 2015 Oct;36(10):4158-63. doi: 10.1002/hbm.22906. Epub 2015 Jul 20.","Dima D","Hum Brain Mapp","2015","2015/07/21","PMC4863074","NIHMS779944","10.1002/hbm.22906"
"25108179","Subcortical amygdala pathways enable rapid face processing","Garvert MM, Friston KJ, Dolan RJ, Garrido MI.","Neuroimage. 2014 Nov 15;102 Pt 2:309-16. doi: 10.1016/j.neuroimage.2014.07.047. Epub 2014 Aug 7.","Garvert MM","Neuroimage","2014","2014/08/10","PMC4229499","","10.1016/j.neuroimage.2014.07.047"
"24041874","Algorithmic procedures for Bayesian MEG/EEG source reconstruction in SPM","López JD, Litvak V, Espinosa JJ, Friston K, Barnes GR.","Neuroimage. 2014 Jan 1;84:476-87. doi: 10.1016/j.neuroimage.2013.09.002. Epub 2013 Sep 13.","López JD","Neuroimage","2014","2013/09/18","PMC3913905","","10.1016/j.neuroimage.2013.09.002"
"23436989","Modelling trial-by-trial changes in the mismatch negativity","Lieder F, Daunizeau J, Garrido MI, Friston KJ, Stephan KE.","PLoS Comput Biol. 2013;9(2):e1002911. doi: 10.1371/journal.pcbi.1002911. Epub 2013 Feb 21.","Lieder F","PLoS Comput Biol","2013","2013/02/26","PMC3578779","","10.1371/journal.pcbi.1002911"
"20631840","The relation of ongoing brain activity, evoked neural responses, and cognition","Sadaghiani S, Hesselmann G, Friston KJ, Kleinschmidt A.","Front Syst Neurosci. 2010 Jun 23;4:20. doi: 10.3389/fnsys.2010.00020. eCollection 2010.","Sadaghiani S","Front Syst Neurosci","2010","2010/07/16","PMC2903187","","10.3389/fnsys.2010.00020"
"18820290","A dual role for prediction error in associative learning","den Ouden HE, Friston KJ, Daw ND, McIntosh AR, Stephan KE.","Cereb Cortex. 2009 May;19(5):1175-85. doi: 10.1093/cercor/bhn161. Epub 2008 Sep 26.","den Ouden HE","Cereb Cortex","2009","2008/09/30","PMC2665159","","10.1093/cercor/bhn161"
"16718653","Analysis of intersubject variability in activation: an application to the incidental episodic retrieval during recognition test","Sugiura M, Friston KJ, Willmes K, Shah NJ, Zilles K, Fink GR.","Hum Brain Mapp. 2007 Jan;28(1):49-58. doi: 10.1002/hbm.20256.","Sugiura M","Hum Brain Mapp","2007","2006/05/24","PMC6871327","","10.1002/hbm.20256"
"15014134","The functional neuroanatomy of temporal discrimination","Pastor MA, Day BL, Macaluso E, Friston KJ, Frackowiak RS.","J Neurosci. 2004 Mar 10;24(10):2585-91. doi: 10.1523/JNEUROSCI.4210-03.2004.","Pastor MA","J Neurosci","2004","2004/03/12","PMC6729480","","10.1523/JNEUROSCI.4210-03.2004"
"10426416","Supra-regional brain systems and the neuropathology of schizophrenia","Wright IC, Sharma T, Ellison ZR, McGuire PK, Friston KJ, Brammer MJ, Murray RM, Bullmore ET.","Cereb Cortex. 1999 Jun;9(4):366-78. doi: 10.1093/cercor/9.4.366.","Wright IC","Cereb Cortex","1999","1999/07/30","","","10.1093/cercor/9.4.366"
"10395332","Correlation between structural and functional changes in brain in an idiopathic headache syndrome","May A, Ashburner J, Büchel C, McGonigle DJ, Friston KJ, Frackowiak RS, Goadsby PJ.","Nat Med. 1999 Jul;5(7):836-8. doi: 10.1038/10561.","May A","Nat Med","1999","1999/07/08","","","10.1038/10561"
"10329749","Statistical parametric mapping with 18F-dopa PET shows bilaterally reduced striatal and nigral dopaminergic function in early Parkinson's disease","Ito K, Morrish PK, Rakshi JS, Uema T, Ashburner J, Bailey DL, Friston KJ, Brooks DJ.","J Neurol Neurosurg Psychiatry. 1999 Jun;66(6):754-8. doi: 10.1136/jnnp.66.6.754.","Ito K","J Neurol Neurosurg Psychiatry","1999","1999/05/18","PMC1736402","","10.1136/jnnp.66.6.754"
"2002358","A direct demonstration of functional specialization in human visual cortex","Zeki S, Watson JD, Lueck CJ, Friston KJ, Kennard C, Frackowiak RS.","J Neurosci. 1991 Mar;11(3):641-9. doi: 10.1523/JNEUROSCI.11-03-00641.1991.","Zeki S","J Neurosci","1991","1991/03/01","PMC6575357","","10.1523/JNEUROSCI.11-03-00641.1991"
"35352057","Music in the brain","Vuust P, Heggli OA, Friston KJ, Kringelbach ML.","Nat Rev Neurosci. 2022 May;23(5):287-305. doi: 10.1038/s41583-022-00578-5. Epub 2022 Mar 29.","Vuust P","Nat Rev Neurosci","2022","2022/03/30","","","10.1038/s41583-022-00578-5"
"35182268","Estimating anisotropy directly via neural timeseries","Fagerholm ED, Foulkes WMC, Gallero-Salas Y, Helmchen F, Moran RJ, Friston KJ, Leech R.","J Comput Neurosci. 2022 May;50(2):241-249. doi: 10.1007/s10827-021-00810-8. Epub 2022 Feb 19.","Fagerholm ED","J Comput Neurosci","2022","2022/02/19","PMC9035010","","10.1007/s10827-021-00810-8"
"33136138","Difficulties with Speech-in-Noise Perception Related to Fundamental Grouping Processes in Auditory Cortex","Holmes E, Zeidman P, Friston KJ, Griffiths TD.","Cereb Cortex. 2021 Feb 5;31(3):1582-1596. doi: 10.1093/cercor/bhaa311.","Holmes E","Cereb Cortex","2021","2020/11/02","PMC7869094","","10.1093/cercor/bhaa311"
"29931740","A brain network model for depression: From symptom understanding to disease intervention","Li BJ, Friston K, Mody M, Wang HN, Lu HB, Hu DW.","CNS Neurosci Ther. 2018 Nov;24(11):1004-1019. doi: 10.1111/cns.12998. Epub 2018 Jun 21.","Li BJ","CNS Neurosci Ther","2018","2018/06/23","PMC6490158","","10.1111/cns.12998"
"28981514","A unifying Bayesian account of contextual effects in value-based choice","Rigoli F, Mathys C, Friston KJ, Dolan RJ.","PLoS Comput Biol. 2017 Oct 5;13(10):e1005769. doi: 10.1371/journal.pcbi.1005769. eCollection 2017 Oct.","Rigoli F","PLoS Comput Biol","2017","2017/10/06","PMC5645156","","10.1371/journal.pcbi.1005769"
"24848380","Impaired frontal-basal ganglia connectivity in adolescents with internet addiction","Li B, Friston KJ, Liu J, Liu Y, Zhang G, Cao F, Su L, Yao S, Lu H, Hu D.","Sci Rep. 2014 May 22;4:5027. doi: 10.1038/srep05027.","Li B","Sci Rep","2014","2014/05/23","PMC4030253","","10.1038/srep05027"
"24174677","Top-down control of visual responses to fear by the amygdala","Furl N, Henson RN, Friston KJ, Calder AJ.","J Neurosci. 2013 Oct 30;33(44):17435-43. doi: 10.1523/JNEUROSCI.2992-13.2013.","Furl N","J Neurosci","2013","2013/11/01","PMC6618361","","10.1523/JNEUROSCI.2992-13.2013"
"21179484","Observing the observer (II): deciding when to decide","Daunizeau J, den Ouden HE, Pessiglione M, Kiebel SJ, Friston KJ, Stephan KE.","PLoS One. 2010 Dec 14;5(12):e15555. doi: 10.1371/journal.pone.0015555.","Daunizeau J","PLoS One","2010","2010/12/24","PMC3001882","","10.1371/journal.pone.0015555"
"20573886","Nonlinear coupling in the human motor system","Chen CC, Kilner JM, Friston KJ, Kiebel SJ, Jolly RK, Ward NS.","J Neurosci. 2010 Jun 23;30(25):8393-9. doi: 10.1523/JNEUROSCI.1194-09.2010.","Chen CC","J Neurosci","2010","2010/06/25","PMC2923068","UKMS31194","10.1523/JNEUROSCI.1194-09.2010"
"20203180","Striatal prediction error modulates cortical coupling","den Ouden HE, Daunizeau J, Roiser J, Friston KJ, Stephan KE.","J Neurosci. 2010 Mar 3;30(9):3210-9. doi: 10.1523/JNEUROSCI.4458-09.2010.","den Ouden HE","J Neurosci","2010","2010/03/06","PMC3044875","UKMS28921","10.1523/JNEUROSCI.4458-09.2010"
"19155345","Dysconnection in schizophrenia: from abnormal synaptic plasticity to failures of self-monitoring","Stephan KE, Friston KJ, Frith CD.","Schizophr Bull. 2009 May;35(3):509-27. doi: 10.1093/schbul/sbn176. Epub 2009 Jan 20.","Stephan KE","Schizophr Bull","2009","2009/01/22","PMC2669579","","10.1093/schbul/sbn176"
"15705611","A PET study exploring the laterality of brainstem activation in migraine using glyceryl trinitrate","Afridi SK, Matharu MS, Lee L, Kaube H, Friston KJ, Frackowiak RS, Goadsby PJ.","Brain. 2005 Apr;128(Pt 4):932-9. doi: 10.1093/brain/awh416. Epub 2005 Feb 10.","Afridi SK","Brain","2005","2005/02/12","","","10.1093/brain/awh416"
"1613546","Functional anatomy of human procedural learning determined with regional cerebral blood flow and PET","Grafton ST, Mazziotta JC, Presty S, Friston KJ, Frackowiak RS, Phelps ME.","J Neurosci. 1992 Jul;12(7):2542-8. doi: 10.1523/JNEUROSCI.12-07-02542.1992.","Grafton ST","J Neurosci","1992","1992/07/01","PMC6575851","","10.1523/JNEUROSCI.12-07-02542.1992"
"37223127","A parahippocampal-sensory Bayesian vicious circle generates pain or tinnitus: a source-localized EEG study","De Ridder D, Friston K, Sedley W, Vanneste S.","Brain Commun. 2023 Apr 20;5(3):fcad132. doi: 10.1093/braincomms/fcad132. eCollection 2023.","De Ridder D","Brain Commun","2023","2023/05/24","PMC10202557","","10.1093/braincomms/fcad132"
