PMID,Title,Authors,Citation,First Author,Journal/Book,Publication Year,Create Date,PMCID,NIHMS ID,DOI
"22047964","Attention reverses the effect of prediction in silencing sensory signals","Kok P, Rahnev D, Jehee JF, Lau HC, de Lange FP.","Cereb Cortex. 2012 Sep;22(9):2197-206. doi: 10.1093/cercor/bhr310. Epub 2011 Nov 2.","Kok P","Cereb Cortex","2012","2011/11/04","","","10.1093/cercor/bhr310"
"29628433","Sensory Prediction Errors Are Less Modulated by Global Context in Autism Spectrum Disorder","Goris J, Braem S, Nijhof AD, Rigoni D, Deschrijver E, Van de Cruys S, Wiersema JR, Brass M.","Biol Psychiatry Cogn Neurosci Neuroimaging. 2018 Aug;3(8):667-674. doi: 10.1016/j.bpsc.2018.02.003. Epub 2018 Mar 6.","Goris J","Biol Psychiatry Cogn Neurosci Neuroimaging","2018","2018/04/10","","","10.1016/j.bpsc.2018.02.003"
"22147913","Evidence for a hierarchy of predictions and prediction errors in human cortex","Wacongne C, Labyt E, van Wassenhove V, Bekinschtein T, Naccache L, Dehaene S.","Proc Natl Acad Sci U S A. 2011 Dec 20;108(51):20754-9. doi: 10.1073/pnas.1117807108. Epub 2011 Dec 6.","Wacongne C","Proc Natl Acad Sci U S A","2011","2011/12/08","PMC3251061","","10.1073/pnas.1117807108"
"33186721","Expected TMS excites the motor system less effectively than unexpected stimulation","Tran DMD, McNair NA, Harris JA, Livesey EJ.","Neuroimage. 2021 Feb 1;226:117541. doi: 10.1016/j.neuroimage.2020.117541. Epub 2020 Nov 11.","Tran DMD","Neuroimage","2021","2020/11/13","","","10.1016/j.neuroimage.2020.117541"
"25678030","On forward inferences of fast and slow readers. An eye movement study","Hawelka S, Schuster S, Gagl B, Hutzler F.","Sci Rep. 2015 Feb 13;5:8432. doi: 10.1038/srep08432.","Hawelka S","Sci Rep","2015","2015/02/14","PMC4327408","","10.1038/srep08432"
"26386775","Object knowledge changes visual appearance: semantic effects on color afterimages","Lupyan G.","Acta Psychol (Amst). 2015 Oct;161:117-30. doi: 10.1016/j.actpsy.2015.08.006. Epub 2015 Sep 18.","Lupyan G","Acta Psychol (Amst)","2015","2015/09/21","","","10.1016/j.actpsy.2015.08.006"
"34296123","Skipping a Beat: Heartbeat-Evoked Potentials Reflect Predictions during Interoceptive-Exteroceptive Integration","Banellis L, Cruse D.","Cereb Cortex Commun. 2020 Sep 1;1(1):tgaa060. doi: 10.1093/texcom/tgaa060. eCollection 2020.","Banellis L","Cereb Cortex Commun","2020","2021/07/23","PMC8153056","","10.1093/texcom/tgaa060"
"33355930","Suppression of the auditory N1 by visual anticipatory motion is modulated by temporal and identity predictability","van Laarhoven T, Stekelenburg JJ, Vroomen J.","Psychophysiology. 2021 Mar;58(3):e13749. doi: 10.1111/psyp.13749. Epub 2020 Dec 23.","van Laarhoven T","Psychophysiology","2021","2020/12/28","PMC7900976","","10.1111/psyp.13749"
"27837657","Expectations about person identity modulate the face-sensitive N170","Johnston P, Overell A, Kaufman J, Robinson J, Young AW.","Cortex. 2016 Dec;85:54-64. doi: 10.1016/j.cortex.2016.10.002. Epub 2016 Oct 21.","Johnston P","Cortex","2016","2016/11/13","","","10.1016/j.cortex.2016.10.002"
"30468778","Temporal expectations modulate face image repetition suppression of early stimulus evoked event-related potentials","Feuerriegel D, Churches O, Coussens S, Keage HAD.","Neuropsychologia. 2019 Jan;122:76-87. doi: 10.1016/j.neuropsychologia.2018.11.010. Epub 2018 Nov 22.","Feuerriegel D","Neuropsychologia","2019","2018/11/24","","","10.1016/j.neuropsychologia.2018.11.010"
"31991241","Raised visual contrast thresholds with intact attention and metacognition in functional motor disorder","Matthews J, Nagao K, Ding C, Newby R, Kempster P, Hohwy J.","Cortex. 2020 Apr;125:161-174. doi: 10.1016/j.cortex.2019.12.009. Epub 2020 Jan 3.","Matthews J","Cortex","2020","2020/01/29","","","10.1016/j.cortex.2019.12.009"
"37500495","Longitudinal Evidence for Attenuated Local-Global Deviance Detection as a Precursor of Working Memory Decline","Hsu YF, Tu CA, Bekinschtein TA, Hämäläinen JA.","eNeuro. 2023 Aug 11;10(8):ENEURO.0156-23.2023. doi: 10.1523/ENEURO.0156-23.2023. Print 2023 Aug.","Hsu YF","eNeuro","2023","2023/07/27","PMC10431235","","10.1523/ENEURO.0156-23.2023"
"28910624","A Sensorimotor Circuit in Mouse Cortex for Visual Flow Predictions","Leinweber M, Ward DR, Sobczak JM, Attinger A, Keller GB.","Neuron. 2017 Sep 13;95(6):1420-1432.e5. doi: 10.1016/j.neuron.2017.08.036.","Leinweber M","Neuron","2017","2017/09/15","","","10.1016/j.neuron.2017.08.036"
"35799044","Interval timing in a hierarchical violation-of-expectation task: Dissociable effects of local and global predictions","Warda S, Khan A.","Atten Percept Psychophys. 2022 Aug;84(6):1982-1993. doi: 10.3758/s13414-022-02533-z. Epub 2022 Jul 7.","Warda S","Atten Percept Psychophys","2022","2022/07/07","","","10.3758/s13414-022-02533-z"
"33362483","Erratum: Addendum: Shaping the Cortical Landscape: Functions and Mechanisms of Top-Down Cortical Feedback Pathways","Zagha E.","Front Syst Neurosci. 2020 Dec 11;14:632485. doi: 10.3389/fnsys.2020.632485. eCollection 2020.","Zagha E","Front Syst Neurosci","2020","2020/12/28","PMC7759620","","10.3389/fnsys.2020.632485"
"25657621","Visual mismatch negativity (vMMN): a prediction error signal in the visual modality","Stefanics G, Astikainen P, Czigler I.","Front Hum Neurosci. 2015 Jan 22;8:1074. doi: 10.3389/fnhum.2014.01074. eCollection 2014.","Stefanics G","Front Hum Neurosci","2015","2015/02/07","PMC4302941","","10.3389/fnhum.2014.01074"
"21147999","Expectation and surprise determine neural population responses in the ventral visual stream","Egner T, Monti JM, Summerfield C.","J Neurosci. 2010 Dec 8;30(49):16601-8. doi: 10.1523/JNEUROSCI.2770-10.2010.","Egner T","J Neurosci","2010","2010/12/15","PMC3975573","EMS57884","10.1523/JNEUROSCI.2770-10.2010"
"29157412","Behavioral oscillation in face priming: Prediction about face identity is updated at a theta-band rhythm","Wang Y, Luo H.","Prog Brain Res. 2017;236:211-224. doi: 10.1016/bs.pbr.2017.06.008. Epub 2017 Jul 18.","Wang Y","Prog Brain Res","2017","2017/11/22","","","10.1016/bs.pbr.2017.06.008"
"22936472","Effects of prior information on decoding degraded speech: an fMRI study","Clos M, Langner R, Meyer M, Oechslin MS, Zilles K, Eickhoff SB.","Hum Brain Mapp. 2014 Jan;35(1):61-74. doi: 10.1002/hbm.22151. Epub 2012 Aug 30.","Clos M","Hum Brain Mapp","2014","2012/09/01","PMC6868994","","10.1002/hbm.22151"
"26388716","Functional constraints in the evolution of brain circuits","Bosman CA, Aboitiz F.","Front Neurosci. 2015 Sep 1;9:303. doi: 10.3389/fnins.2015.00303. eCollection 2015.","Bosman CA","Front Neurosci","2015","2015/09/22","PMC4555059","","10.3389/fnins.2015.00303"
"34354560","Unstable Gaze in Functional Dizziness: A Contribution to Understanding the Pathophysiology of Functional Disorders","Schröder L, von Werder D, Ramaioli C, Wachtler T, Henningsen P, Glasauer S, Lehnen N.","Front Neurosci. 2021 Jul 20;15:685590. doi: 10.3389/fnins.2021.685590. eCollection 2021.","Schröder L","Front Neurosci","2021","2021/08/06","PMC8330597","","10.3389/fnins.2021.685590"
"24391618","Prediction, attention, and unconscious processing in hierarchical auditory perception","Paquette S, Mignault Goulet G, Rothermich K.","Front Psychol. 2013 Dec 18;4:955. doi: 10.3389/fpsyg.2013.00955. eCollection 2013.","Paquette S","Front Psychol","2013","2014/01/07","PMC3866800","","10.3389/fpsyg.2013.00955"
"27903727","Predicting ""When"" in Discourse Engages the Human Dorsal Auditory Stream: An fMRI Study Using Naturalistic Stories","Kandylaki KD, Nagels A, Tune S, Kircher T, Wiese R, Schlesewsky M, Bornkessel-Schlesewsky I.","J Neurosci. 2016 Nov 30;36(48):12180-12191. doi: 10.1523/JNEUROSCI.4100-15.2016.","Kandylaki KD","J Neurosci","2016","2016/12/02","PMC5148219","","10.1523/JNEUROSCI.4100-15.2016"
"25955846","Auditory mismatch negativity and repetition suppression deficits in schizophrenia explained by irregular computation of prediction error","Rentzsch J, Shen C, Jockers-Scherübl MC, Gallinat J, Neuhaus AH.","PLoS One. 2015 May 8;10(5):e0126775. doi: 10.1371/journal.pone.0126775. eCollection 2015.","Rentzsch J","PLoS One","2015","2015/05/09","PMC4425493","","10.1371/journal.pone.0126775"
"29161556","Adaptation can explain evidence for encoding of probabilistic information in macaque inferior temporal cortex","Vinken K, Vogels R.","Curr Biol. 2017 Nov 20;27(22):R1210-R1212. doi: 10.1016/j.cub.2017.09.018.","Vinken K","Curr Biol","2017","2017/11/22","","","10.1016/j.cub.2017.09.018"
"26620928","Cardio-visual integration modulates the subjective perception of affectively neutral stimuli","Azevedo RT, Ainley V, Tsakiris M.","Int J Psychophysiol. 2016 Jan;99:10-7. doi: 10.1016/j.ijpsycho.2015.11.011. Epub 2015 Nov 24.","Azevedo RT","Int J Psychophysiol","2016","2015/12/02","","","10.1016/j.ijpsycho.2015.11.011"
"30123172","The Object Orientation Effect in Exocentric Distances","Weller M, Takahashi K, Watanabe K, Bülthoff HH, Meilinger T.","Front Psychol. 2018 Aug 3;9:1374. doi: 10.3389/fpsyg.2018.01374. eCollection 2018.","Weller M","Front Psychol","2018","2018/08/21","PMC6085577","","10.3389/fpsyg.2018.01374"
"23145260","Putting reward in art: A tentative prediction error account of visual art","Van de Cruys S, Wagemans J.","Iperception. 2011;2(9):1035-62. doi: 10.1068/i0466aap. Epub 2011 Dec 15.","Van de Cruys S","Iperception","2011","2012/11/13","PMC3485793","","10.1068/i0466aap"
"34662720","Social prediction in pediatric patients with congenital, non-progressive malformations of the cerebellum: From deficits in predicting movements to rehabilitation in virtual reality","Urgesi C, Butti N, Finisguerra A, Biffi E, Valente EM, Romaniello R, Borgatti R.","Cortex. 2021 Nov;144:82-98. doi: 10.1016/j.cortex.2021.08.008. Epub 2021 Sep 24.","Urgesi C","Cortex","2021","2021/10/18","","","10.1016/j.cortex.2021.08.008"
"36773476","Subjective perception of objects depends on the interaction between the validity of context-based expectations and signal reliability","Rossel P, Peyrin C, Kauffmann L.","Vision Res. 2023 May;206:108191. doi: 10.1016/j.visres.2023.108191. Epub 2023 Feb 9.","Rossel P","Vision Res","2023","2023/02/11","","","10.1016/j.visres.2023.108191"
"37625330","Anticipatory and target related ""match/mismatch"" activities of the TPJ: Reply to comments on ""Left and right temporal-parietal junctions (TPJs) as ""match/mismatch"" hedonic machines: A unifying account of TPJ function""","Doricchi F, Lasaponara S, Pazzaglia M, Silvetti M.","Phys Life Rev. 2023 Sep;46:286-291. doi: 10.1016/j.plrev.2023.07.015. Epub 2023 Aug 1.","Doricchi F","Phys Life Rev","2023","2023/08/25","","","10.1016/j.plrev.2023.07.015"
"21297865","Communicative interactions improve visual detection of biological motion","Manera V, Becchio C, Schouten B, Bara BG, Verfaillie K.","PLoS One. 2011 Jan 26;6(1):e14594. doi: 10.1371/journal.pone.0014594.","Manera V","PLoS One","2011","2011/02/08","PMC3027618","","10.1371/journal.pone.0014594"
"32226564","A neural network model for exogenous perceptual alternations of the Necker cube","Araki O, Tsuruoka Y, Urakawa T.","Cogn Neurodyn. 2020 Apr;14(2):229-237. doi: 10.1007/s11571-019-09565-6. Epub 2019 Dec 2.","Araki O","Cogn Neurodyn","2020","2020/04/01","PMC7090121","","10.1007/s11571-019-09565-6"
"32499726","A Computational Theory of Mindfulness Based Cognitive Therapy from the ""Bayesian Brain"" Perspective","Manjaly ZM, Iglesias S.","Front Psychiatry. 2020 May 15;11:404. doi: 10.3389/fpsyt.2020.00404. eCollection 2020.","Manjaly ZM","Front Psychiatry","2020","2020/06/06","PMC7243935","","10.3389/fpsyt.2020.00404"
"32087398","Autistic traits are associated with atypical precision-weighted integration of top-down and bottom-up neural signals","Coll MP, Whelan E, Catmur C, Bird G.","Cognition. 2020 Jun;199:104236. doi: 10.1016/j.cognition.2020.104236. Epub 2020 Feb 19.","Coll MP","Cognition","2020","2020/02/23","","","10.1016/j.cognition.2020.104236"
"23663557","The problem with brain GUTs: conflation of different senses of ""prediction"" threatens metaphysical disaster","Anderson ML, Chemero T.","Behav Brain Sci. 2013 Jun;36(3):204-5. doi: 10.1017/S0140525X1200221X. Epub 2013 May 10.","Anderson ML","Behav Brain Sci","2013","2013/05/14","","","10.1017/S0140525X1200221X"
"35130017","It makes sense, so I see it better! Contextual information about the visual environment increases its perceived sharpness","Rossel P, Peyrin C, Roux-Sibilon A, Kauffmann L.","J Exp Psychol Hum Percept Perform. 2022 Apr;48(4):331-350. doi: 10.1037/xhp0000993. Epub 2022 Feb 7.","Rossel P","J Exp Psychol Hum Percept Perform","2022","2022/02/07","","","10.1037/xhp0000993"
"28223949","How You Move Is What I See: Planning an Action Biases a Partner's Visual Search","Dötsch D, Vesper C, Schubö A.","Front Psychol. 2017 Feb 7;8:77. doi: 10.3389/fpsyg.2017.00077. eCollection 2017.","Dötsch D","Front Psychol","2017","2017/02/23","PMC5293805","","10.3389/fpsyg.2017.00077"
"35389770","Late N1 and postimperative negative variation analysis depending on the previous trial history in paradigms of increasing auditory complexity","Ruiz-Martínez FJ, Morales-Ortiz M, Gómez CM.","J Neurophysiol. 2022 May 1;127(5):1240-1252. doi: 10.1152/jn.00313.2021. Epub 2022 Apr 7.","Ruiz-Martínez FJ","J Neurophysiol","2022","2022/04/07","","","10.1152/jn.00313.2021"
"23755353","Weak priors versus overfitting of predictions in autism: Reply to Pellicano and Burr (TICS, 2012)","Van de Cruys S, de-Wit L, Evers K, Boets B, Wagemans J.","Iperception. 2013 Feb 25;4(2):95-7. doi: 10.1068/i0580ic. Print 2013.","Van de Cruys S","Iperception","2013","2013/06/12","PMC3677336","","10.1068/i0580ic"
"33897518","Overly Strong Priors for Socially Meaningful Visual Signals Are Linked to Psychosis Proneness in Healthy Individuals","Stuke H, Kress E, Weilnhammer VA, Sterzer P, Schmack K.","Front Psychol. 2021 Apr 8;12:583637. doi: 10.3389/fpsyg.2021.583637. eCollection 2021.","Stuke H","Front Psychol","2021","2021/04/26","PMC8061414","","10.3389/fpsyg.2021.583637"
"20092923","Neuroimaging and neuroenergetics: brain activations as information-driven reorganization of energy flows","Strelnikov K.","Brain Cogn. 2010 Apr;72(3):449-56. doi: 10.1016/j.bandc.2009.12.008. Epub 2010 Jan 25.","Strelnikov K","Brain Cogn","2010","2010/01/23","","","10.1016/j.bandc.2009.12.008"
"24860544","The worldly constituents of perceptual presence","Di Paolo EA.","Front Psychol. 2014 May 15;5:450. doi: 10.3389/fpsyg.2014.00450. eCollection 2014.","Di Paolo EA","Front Psychol","2014","2014/05/27","PMC4030179","","10.3389/fpsyg.2014.00450"
"29572912","Guidance of spatial attention during associative learning: Contributions of predictability and intention to learn","Do Carmo Blanco N, Allen JJB.","Psychophysiology. 2018 Aug;55(8):e13077. doi: 10.1111/psyp.13077. Epub 2018 Mar 23.","Do Carmo Blanco N","Psychophysiology","2018","2018/03/25","","","10.1111/psyp.13077"
"22811008","Concurrent repetition enhancement and suppression responses in extrastriate visual cortex","de Gardelle V, Waszczuk M, Egner T, Summerfield C.","Cereb Cortex. 2013 Sep;23(9):2235-44. doi: 10.1093/cercor/bhs211. Epub 2012 Jul 18.","de Gardelle V","Cereb Cortex","2013","2012/07/20","PMC3729201","","10.1093/cercor/bhs211"
"33340115","Both contextual regularity and selective attention affect the reduction of precision-weighted prediction errors but in distinct manners","Hsu YF, Hämäläinen JA.","Psychophysiology. 2021 Mar;58(3):e13753. doi: 10.1111/psyp.13753. Epub 2020 Dec 19.","Hsu YF","Psychophysiology","2021","2020/12/19","","","10.1111/psyp.13753"
"25107844","Toward an integrative view of human pain and suffering. Reply to comments on ""Facing the experience of pain: a neuropsychological perspective""","Fabbro F, Crescentini C.","Phys Life Rev. 2014 Sep;11(3):569-72. doi: 10.1016/j.plrev.2014.07.006. Epub 2014 Jul 23.","Fabbro F","Phys Life Rev","2014","2014/08/10","","","10.1016/j.plrev.2014.07.006"
"25228877","When does repetition suppression depend on repetition probability?","Kovács G, Vogels R.","Front Hum Neurosci. 2014 Sep 2;8:685. doi: 10.3389/fnhum.2014.00685. eCollection 2014.","Kovács G","Front Hum Neurosci","2014","2014/09/18","PMC4151029","","10.3389/fnhum.2014.00685"
"35780398","Inferior temporal cortex leads prefrontal cortex in response to a violation of a learned sequence","Esmailpour H, Raman R, Vogels R.","Cereb Cortex. 2023 Mar 10;33(6):3124-3141. doi: 10.1093/cercor/bhac265.","Esmailpour H","Cereb Cortex","2023","2022/07/03","","","10.1093/cercor/bhac265"
"32858473","Measures of repetition suppression in the fusiform face area are inflated by co-occurring effects of statistically learned visual associations","Rostalski SM, Amado C, Kovács G, Feuerriegel D.","Cortex. 2020 Oct;131:123-136. doi: 10.1016/j.cortex.2020.07.010. Epub 2020 Jul 29.","Rostalski SM","Cortex","2020","2020/08/29","","","10.1016/j.cortex.2020.07.010"
"34533061","Associative learning under uncertainty in adults with autism: Intact learning of the cue-outcome contingency, but slower updating of priors","Sapey-Triomphe LA, Weilnhammer VA, Wagemans J.","Autism. 2022 Jul;26(5):1216-1228. doi: 10.1177/13623613211045026. Epub 2021 Sep 17.","Sapey-Triomphe LA","Autism","2022","2021/09/17","","","10.1177/13623613211045026"
"28479473","Using guitar learning to probe the Action Observation Network's response to visuomotor familiarity","Gardner T, Aglinskas A, Cross ES.","Neuroimage. 2017 Aug 1;156:174-189. doi: 10.1016/j.neuroimage.2017.04.060. Epub 2017 May 4.","Gardner T","Neuroimage","2017","2017/05/09","","","10.1016/j.neuroimage.2017.04.060"
"30109125","Early effects of previous experience on conscious perception","Aru J, Rutiku R, Wibral M, Singer W, Melloni L.","Neurosci Conscious. 2016 May 9;2016(1):niw004. doi: 10.1093/nc/niw004. eCollection 2016.","Aru J","Neurosci Conscious","2016","2018/08/16","PMC6084554","","10.1093/nc/niw004"
"30526338","Individual differences in sensory sensitivity: A synthesizing framework and evidence from normal variation and developmental conditions","Ward J.","Cogn Neurosci. 2019 Jul;10(3):139-157. doi: 10.1080/17588928.2018.1557131. Epub 2018 Dec 24.","Ward J","Cogn Neurosci","2019","2018/12/12","","","10.1080/17588928.2018.1557131"
"30609322","The Ganzfeld experience-A stably inducible altered state of consciousness: Effects of different auditory homogenizations","Schmidt TT, Prein JC.","Psych J. 2019 Mar;8(1):66-81. doi: 10.1002/pchj.262. Epub 2019 Jan 4.","Schmidt TT","Psych J","2019","2019/01/05","","","10.1002/pchj.262"
"31525646","Wearing your heart on your screen: Investigating congruency-effects in autonomic responses and their role in interoceptive processing during biofeedback","Hodossy L, Tsakiris M.","Cognition. 2020 Jan;194:104053. doi: 10.1016/j.cognition.2019.104053. Epub 2019 Sep 13.","Hodossy L","Cognition","2020","2019/09/17","","","10.1016/j.cognition.2019.104053"
"3241499","[A classification of crackles by the linear predictive coding method]","Maeda Y, Nitta K, Yui Y, Shida T, Wagatsuma K, Muraoka T.","Nihon Kyobu Shikkan Gakkai Zasshi. 1988 Jun;26(6):587-93.","Maeda Y","Nihon Kyobu Shikkan Gakkai Zasshi","1988","1988/06/01","","",""
"30172951","Neural plasticity is modified over the human menstrual cycle: Combined insight from sensory evoked potential LTP and repetition suppression","Sumner RL, Spriggs MJ, McMillan RL, Sundram F, Kirk IJ, Muthukumaraswamy SD.","Neurobiol Learn Mem. 2018 Nov;155:422-434. doi: 10.1016/j.nlm.2018.08.016. Epub 2018 Aug 30.","Sumner RL","Neurobiol Learn Mem","2018","2018/09/03","","","10.1016/j.nlm.2018.08.016"
"26441602","Implicit learning of predictable sound sequences modulates human brain responses at different levels of the auditory hierarchy","Lecaignard F, Bertrand O, Gimenez G, Mattout J, Caclin A.","Front Hum Neurosci. 2015 Sep 16;9:505. doi: 10.3389/fnhum.2015.00505. eCollection 2015.","Lecaignard F","Front Hum Neurosci","2015","2015/10/07","PMC4584941","","10.3389/fnhum.2015.00505"
"23734133","The many faces of precision (Replies to commentaries on ""Whatever next? Neural prediction, situated agents, and the future of cognitive science"")","Clark A.","Front Psychol. 2013 May 21;4:270. doi: 10.3389/fpsyg.2013.00270. eCollection 2013.","Clark A","Front Psychol","2013","2013/06/05","PMC3659294","","10.3389/fpsyg.2013.00270"
"24501593","Local active information storage as a tool to understand distributed neural information processing","Wibral M, Lizier JT, Vögler S, Priesemann V, Galuske R.","Front Neuroinform. 2014 Jan 28;8:1. doi: 10.3389/fninf.2014.00001. eCollection 2014.","Wibral M","Front Neuroinform","2014","2014/02/07","PMC3904075","","10.3389/fninf.2014.00001"
"23874278","The role of auditory transient and deviance processing in distraction of task performance: a combined behavioral and event-related brain potential study","Berti S.","Front Hum Neurosci. 2013 Jul 11;7:352. doi: 10.3389/fnhum.2013.00352. eCollection 2013.","Berti S","Front Hum Neurosci","2013","2013/07/23","PMC3708154","","10.3389/fnhum.2013.00352"
"23630514","Impaired global, and compensatory local, biological motion processing in people with high levels of autistic traits","van Boxtel JJ, Lu H.","Front Psychol. 2013 Apr 23;4:209. doi: 10.3389/fpsyg.2013.00209. eCollection 2013.","van Boxtel JJ","Front Psychol","2013","2013/05/01","PMC3632794","","10.3389/fpsyg.2013.00209"
"27826271","Why Harmless Sensations Might Hurt in Individuals with Chronic Pain: About Heightened Prediction and Perception of Pain in the Mind","Hechler T, Endres D, Thorwart A.","Front Psychol. 2016 Oct 25;7:1638. doi: 10.3389/fpsyg.2016.01638. eCollection 2016.","Hechler T","Front Psychol","2016","2016/11/10","PMC5078757","","10.3389/fpsyg.2016.01638"
"25132020","Face processing regions are sensitive to distinct aspects of temporal sequence in facial dynamics","Reinl M, Bartels A.","Neuroimage. 2014 Nov 15;102 Pt 2:407-15. doi: 10.1016/j.neuroimage.2014.08.011. Epub 2014 Aug 12.","Reinl M","Neuroimage","2014","2014/08/19","","","10.1016/j.neuroimage.2014.08.011"
"18296144","New studies on adaptive predictive coding of images using multiplicative autoregressive models","Das M, Loh NK.","IEEE Trans Image Process. 1992;1(1):106-11. doi: 10.1109/83.128035.","Das M","IEEE Trans Image Process","1992","1992/01/01","","","10.1109/83.128035"
"20631184","Extracellular potentials modify the transfer of information at photoreceptor output synapses in the blowfly compound eye","Weckström M, Laughlin S.","J Neurosci. 2010 Jul 14;30(28):9557-66. doi: 10.1523/JNEUROSCI.6122-09.2010.","Weckström M","J Neurosci","2010","2010/07/16","PMC6632427","","10.1523/JNEUROSCI.6122-09.2010"
"33424742","Nocebo-Hypothesis Cognitive Behavioral Therapy (NH-CBT) for Persons With Functional Neurological Symptoms (Motor Type): Design and Implementation of a Randomized Active-Controlled Trial","Richardson M, Kleinstäuber M, Wong D.","Front Neurol. 2020 Dec 7;11:586359. doi: 10.3389/fneur.2020.586359. eCollection 2020.","Richardson M","Front Neurol","2020","2021/01/11","PMC7793953","","10.3389/fneur.2020.586359"
"10505381","A chaos-based model for low complexity predictive coding scheme for compression and transmission of electroencephalogram data","Kavitha V, Dutt DN.","Med Biol Eng Comput. 1999 May;37(3):316-21. doi: 10.1007/BF02513306.","Kavitha V","Med Biol Eng Comput","1999","1999/10/03","","","10.1007/BF02513306"
"9185723","Analysis of voice changes after thyroplasty using linear predictive coding","Plant RL, Hillel AD, Waugh PF.","Laryngoscope. 1997 Jun;107(6):703-9. doi: 10.1097/00005537-199706000-00001.","Plant RL","Laryngoscope","1997","1997/06/01","","","10.1097/00005537-199706000-00001"
"25983690","Simultaneous learning and filtering without delusions: a Bayes-optimal combination of Predictive Inference and Adaptive Filtering","Kneissler J, Drugowitsch J, Friston K, Butz MV.","Front Comput Neurosci. 2015 Apr 30;9:47. doi: 10.3389/fncom.2015.00047. eCollection 2015.","Kneissler J","Front Comput Neurosci","2015","2015/05/19","PMC4415408","","10.3389/fncom.2015.00047"
"27639360","When expectation confounds iconic memory","Bachmann T, Aru J.","Conscious Cogn. 2016 Oct;45:198-199. doi: 10.1016/j.concog.2016.08.020. Epub 2016 Sep 15.","Bachmann T","Conscious Cogn","2016","2016/09/19","","","10.1016/j.concog.2016.08.020"
"23663456","Whenever next: hierarchical timing of perception and action","Holm L, Madison G.","Behav Brain Sci. 2013 Jun;36(3):217-8. doi: 10.1017/S0140525X12002336. Epub 2013 May 10.","Holm L","Behav Brain Sci","2013","2013/05/14","","","10.1017/S0140525X12002336"
"25691861","Visual homeostatic processing in V1: when probability meets dynamics","Nortmann N, Rekauzke S, Azimi Z, Onat S, König P, Jancke D.","Front Syst Neurosci. 2015 Feb 3;9:6. doi: 10.3389/fnsys.2015.00006. eCollection 2015.","Nortmann N","Front Syst Neurosci","2015","2015/02/19","PMC4315031","","10.3389/fnsys.2015.00006"
"28121017","Information-Theoretic Properties of Auditory Sequences Dynamically Influence Expectation and Memory","Agres K, Abdallah S, Pearce M.","Cogn Sci. 2018 Jan;42(1):43-76. doi: 10.1111/cogs.12477. Epub 2017 Jan 25.","Agres K","Cogn Sci","2018","2017/01/26","","","10.1111/cogs.12477"
"25408640","Dynamical predictions of insular hubs for social cognition and their application to stroke","Limongi R, Tomio A, Ibanez A.","Front Behav Neurosci. 2014 Nov 4;8:380. doi: 10.3389/fnbeh.2014.00380. eCollection 2014.","Limongi R","Front Behav Neurosci","2014","2014/11/20","PMC4219475","","10.3389/fnbeh.2014.00380"
"27600371","Commentary: Beta-Band Oscillations Represent Auditory Beat and Its Metrical Hierarchy in Perception and Imagery","Teki S, Kononowicz TW.","Front Neurosci. 2016 Aug 23;10:389. doi: 10.3389/fnins.2016.00389. eCollection 2016.","Teki S","Front Neurosci","2016","2016/09/08","PMC4993780","","10.3389/fnins.2016.00389"
